"name","desc","type1","type2","egg_group"
"비크티니","승리를 이끄는 포켓몬이다.비크티니를 데리고 있는 트레이너는 그 어떠한 승부에서도 '항상' 승리한다고 한다.몸 안에서 무한의 에너지를 만들어 낸다. 자신이 만난 상대에게 이 에너지를 나누어 준다.비크티니가 무한히 만들어내는 에너지를 나누어 받으면 전신에 파워가 넘친다.승리를 부르는 포켓몬이다.비크티니와 함께하는 트레이너는 그 어떤 승부에서도 승리한다고 한다.비크티니가 무한히 만들어내는 에너지를 나누어 받으면 전신에 파워가 넘친다.승리를 부르는 포켓몬이다.비크티니와 함께하는 트레이너는 그 어떤 승부에서도 승리한다고 한다.비크티니가 무한히 만들어내는 에너지를 나누어 받으면 전신에 파워가 넘친다.도감에 없음등장하지 않음도감에 없음","에스퍼","불꽃","알미발견"
"주리비얀","지능이 높아 매우 냉정. 햇빛을 듬뿍 쬐면 움직임이 날카로워진다.꼬리로 태양의 빛을 받아 광합성한다. 기운이 빠지면 꼬리가 축 늘어진다.태양의 빛을 받으면 평소보다 빨리 움직일 수 있다. 손보다 덩굴을 잘 사용한다.꼬리로 태양의 빛을 받아 광합성한다. 기운이 빠지면 꼬리가 축 늘어진다.자료 없음","풀","","육상,식물"
"샤비","땅을 미끄러지듯 달린다. 빠른 움직임으로 상대를 혼란시키고 덩쿨채찍으로 꼼짝 못하게 한다.무성한 초목의 그림자를 헤쳐나가며 공격을 피한다. 채찍으로 능숙하게 반격한다.몸이 더러워지면 잎으로 광합성을 할 수 없기 때문에 항상 청결하게 하고 있다.자료 없음","풀","","육상,식물"
"샤로다","째려보는 것만으로 상대의 움직임을 멈춰버리게 한다. 태양 에너지를 몸 안에서 증폭시킨다.머리를 높이 치켜들어 상대를 위압한다. 강한 적과 싸울 때만 진정한 힘을 발휘한다.샤로다의 고상한 눈동자로 쏘아보아도 태연할 정도로 강한 상대에게만 진정한 실력을 발휘한다.째려보기만 해도 상대의 움직임을 멈추게 한다. 태양에너지를 체내에서 증폭시킨다.자료 없음","풀","","육상,식물"
"뚜꾸리","적의 공격을 가볍게 피해서 코에서 불의 구체를 쏘아낸다. 불꽃으로 나무열매를 구워서 먹는다.콧구멍에서 불꽃을 뿜는다. 감기에 걸리면 불꽃이 아니라 검은 연기가 되어버린다.구운 나무열매를 먹는 것을 매우 좋아하지만 너무 흥분해서 가끔 새까맣게 태워버린다.적의 공격을 가볍게 피하고 코로 불구슬을 쏘아댄다. 불꽃으로 나무열매를 구워 먹는다.구운 나무열매를 먹는 것을 매우 좋아하지만 너무 흥분해서 가끔 새까맣게 태워버린다.자료 없음","불꽃","","육상"
"차오꿀","체내의 불꽃이 타오르면 움직임의 날카로움과 스피드가 빨라진다.위기 상황이 되면 연기를 뿜어낸다.먹은 것을 연료로 하여 위에서 불꽃을 태우는 것이다. 화가 나면 화력이 오른다.먹을수록 태울 것이 많아져 위 속의 불꽃이 강해지고 파워도 점점 넘치게 된다.체내의 불꽃이 타오르면 움직임이 더 빠르고 예리해진다. 위급해지면 연기를 뿜어낸다.자료 없음","불꽃","격투","육상"
"염무왕","아랫턱의 불꽃으로 주먹을 불태워 불꽃의 펀치를 내지른다. 매우 동료를 아끼는 포켓몬.불꽃 턱수염을 기른다. 파워와 스피드를 겸비한 격투 기술을 가지고 있다.턱수염의 불꽃이 불타오르는 것은 기합이 들어간 증거. 수많은 기술을 능숙하게 다룬다.턱의 화염으로 주먹을 불태워 불꽃펀치를 날린다. 동료애가 깊은 포켓몬이다.불꽃 턱수염을 기르고 있다. 파워와 스피드를 겸비한 격투 기술을 익히고 있다.자료 없음","불꽃","격투","육상"
"수댕이","배의 조가비로 싸운다. 공격을 막고 그 즉시 베어 반격한다.배의 가리비칼은 손톱과 같은 성분으로 되어져 있다. 배에서 떼어내어 주머니칼로서 사용한다.배에 생기는 가리비칼은 싸울 때뿐 아니라 딱딱한 나무열매를 쪼갤 때도 사용한다.배에 있는 가리비칼로 싸운다. 공격을 막고 그 즉시 베어 반격한다.배에 생기는 가리비칼은 싸울 때뿐 아니라 딱딱한 나무열매를 쪼갤 때도 사용한다.배에 있는 가리비칼로 싸운다. 공격을 막고 그 즉시 베어 반격한다.자료 없음","물","","육상"
"쌍검자비","흐르는듯한 칼 솜씨로 두개의 조가비를 다루는 기술은 혹독한 수행으로 몸에 익힌다.익힌 조가비칼 기술은 쌍검자비마다 다르다. 조가비칼의 손질은 거르지 않는다.혹독한 수행 끝에 쌍검자비마다 다른 형태의 가리비칼 다루는 기술을 습득한다.물 흐르는 듯한 칼솜씨로 2개의 가리비칼을 사용하는 기술은 엄격한 수련을 통해 익힌 것이다.혹독한 수행 끝에 쌍검자비마다 다른 형태의 가리비칼 다루는 기술을 습득한다.자료 없음","물","","육상"
"대검귀","갑옷에 장착된 검을 한번 휘두름으로 상대를 쓰러뜨린다.한번의 노려봄으로 적을 멈추게 할수 있다.앞발의 갑옷 일부가 큰 검이 되어져 있다. 으르렁거리는 것만으로 상대를 위압한다.상대가 눈을 깜빡이는 동안에 앞다리에 붙어 있는 각검으로 상대를 베고 원래대로 되돌린다.갑옷에 내장된 검으로 한칼에 상대를 제압한다. 눈빛만으로 상대를 침묵시킨다.자료 없음","물","","육상"
"보르쥐","볼의 주머니에 먹이를 저축하여 며칠이고 망보기를 계속한다. 꼬리로 동료에게 신호한다.경계심이 강해 교대로 서식지 주변을 계속 망을 보고 있다. 망보기가 없으면 불안한 것이다.경계심이 강해서 반드시 한 마리는 망을 보고 있으나 뒤에서 오는 상대는 알아차리지 못한다.자료 없음","노말","","육상"
"보르그","볼의 주머니에 모아둔 열매의 씨를 날려서 공격. 적을 발견하면 꼬리를 치켜세운다.몸의 문양을 빛내서 적을 위협한다. 어두운 곳이라도 주변을 볼 수 있는 눈을 가졌다.체내의 발광물질로 눈이나 몸을 빛나게 하여 습격해 온 상대를 풀이 죽게 만든다.뺨의 주머니에 모아둔 나무열매의 씨앗을 날려서 공격한다. 적을 발견하면 꼬리를 세운다.자료 없음","노말","","육상"
"요테리","강한 상대에게도 용감히 대항하지만 불리한 싸움을 피하는 지능이 높은 포켓몬.얼굴을 덮은 긴 털은 뛰어난 레이더. 주위의 상태를 민감하게 살핀다.용맹한 포켓몬이지만 상대의 강함을 확인하고 싸움을 피하는 영리함도 함께 갖추고 있다.얼굴을 둘러싼 긴 털은 우수한 레이더다. 주위 상황을 민감히 살핀다.용맹한 포켓몬이지만 상대의 강함을 확인하고 싸움을 피하는 영리함도 함께 갖추고 있다.얼굴을 둘러싼 긴 털은 우수한 레이더다. 주위 상황을 민감히 살핀다.용맹한 포켓몬이지만 상대의 강함을 확인하고 싸움을 피하는 영리함도 함께 갖추고 있다.컹컹 짖거나 하지 않으므로 맨션에 사는 트레이너에게 인기가 많은 포켓몬이다.얼굴을 둘러싼 털은 레이더 역할을 하여 싸우는 상대의 상태를 살핀다.판단력이 뛰어난 포켓몬. 이길 수 없는 상대라고 판단되면 바로 꼬리를 내리고 도망친다.영리해서 트레이너가 하는 말을 잘 따르기 때문에 초보자라도 키우기 쉬워서 인기 있는 포켓몬이다.등장하지 않음용감하고 신중하다. 얼굴을 덮고 있는 부드러운 털로 주변의 정보를 캐치한다.또래의 아이보다 훨씬 영리하다. 사랑받은 것도 혼난 것도 잊지 않는다.","노말","","육상"
"하데리어","망토처럼 몸을 덮은 검은 체모는 매우 견고하다. 받은 데미지를 줄여준다.트레이너의 지시에 충실. 오랜 옛날부터 포켓몬을 키워준 트레이너를 도왔다.트레이너를 도와주면서 다른 포켓몬을 돌보기도 하는 매우 충실한 포켓몬.매우 단단한 검은 털이 망토처럼 몸을 둘러싸고 있다. 입은 데미지를 줄여준다.트레이너를 도와주면서 다른 포켓몬을 돌보기도 하는 매우 충실한 포켓몬.매우 단단한 검은 털이 망토처럼 몸을 둘러싸고 있다. 입은 데미지를 줄여준다.검은 털은 매우 단단하며 빠르게 자란다. 손질 비용이 들어서 큰일인 포켓몬.주인의 명령에 충실하다. 그러나 아래라고 보는 상대가 하는 말은 절대로 듣지 않는다.검은 털은 자랄수록 딱딱하고 튼튼해져 발톱이나 이빨로도 쉽게 뚫을 수 없다.먼 옛날의 벽화에 모습이 그려져 있을 정도로 오랫동안 인간과 생활을 함께해 왔다.등장하지 않음매우 영리하고 금방 친해진다. 인간의 파트너가 된 첫 포켓몬이라는 설도 있다.몸을 뒤덮은 검은 털은 두껍고 탄력이 있다. 날카로운 이빨도 튕겨낸다.","노말","","육상"
"바랜드","눈보라로 막힌 산에 들어온 조난당한 사람을 도운다. 긴 털이 추위를 막는다.산이나 바다에 조난된 사람을 구조하는 것이 특기. 매우 영리한 포켓몬.긴 털에 둘러싸이면 겨울 산에서 하룻밤을 보내도 괜찮을 정도로 따뜻하고 매우 기분이 좋다.눈보라로 길이 막힌 산에 들어가 조난당한 사람을 구해준다. 긴 털이 추위를 막는다.긴 털에 둘러싸이면 겨울 산에서 하룻밤을 보내도 괜찮을 정도로 따뜻하고 매우 기분이 좋다.눈보라로 길이 막힌 산에 들어가 조난당한 사람을 구해준다. 긴 털이 추위를 막는다.긴 털에 둘러싸이면 겨울 산에서 하룻밤을 보내도 괜찮을 정도로 따뜻하고 매우 기분이 좋다.똑똑하고 온후하며 용감하다. 구조대 대원들의 믿음직한 동료이다.영리해서 사람을 공격할 걱정이 없어 아이를 돌보게 하는 부모도 있다.길고 따뜻한 털 덕분에 추위는 걱정 없다. 알로라의 바랜드는 조금 괴로운 것 같다.길고 두꺼운 털을 가졌다. 옛날 추운 지방에서는 한 집에 1마리씩 바랜드를 키웠다.등장하지 않음사람과 사는 것을 좋아하는 듯하다. 야생에서 잡아도 3일만 지나면 사람을 따르게 된다.훌륭한 수염이 특징인 포켓몬이다. 그 길이로 동료들과 우열을 가린다고 한다.","노말","","육상"
"쌔비냥","사람의 물건을 장난으로 훔친다. 도둑질당한 사람도 귀여운 시늉에 바로 용서하고 만다.귀여운 듯한 태도에 방심해버리면 그 틈에 물건을 훔친다. 화를 내면 손톱을 세워서 반격.귀여운 행동으로 방심하게 한 후 소중한 물건을 훔치는 것은 사람의 곤란해하는 모습을 보고 싶어서다.귀여운 듯한 태도에 방심해버리면 그 틈에 물건을 훔친다. 화를 내면 손톱을 세워서 반격.사람의 물건을 장난으로 훔친다. 도둑질당한 사람도 귀여운 시늉에 바로 용서하고 만다.귀여운 듯한 태도에 방심해버리면 그 틈에 물건을 훔친다. 화를 내면 손톱을 세워서 반격.사람의 물건을 장난으로 훔친다. 도둑질당한 사람도 귀여운 시늉에 바로 용서하고 만다.도감에 없음등장하지 않음곤란해하는 모습을 보기 위해 사람의 물건을 훔친다. 훔처우와는 라이벌 관계다.귀여운 동작으로 방심심키고 상대가 다가오면 갑자기 발톱으로 할퀴고는 웃는다.","악","","육상"
"레파르다스","신출귀몰한 포켓몬. 아름다운 스타일과 털의 결이 많은 트레이너를 매혹시킨다.기척을 죽이고 접근한다. 상대가 눈치채기 전에 배후에서 살며시 다가가서 괴롭히는 것이다.아름다운 스타일은 전신의 발달한 근육 덕분이다. 소리도 내지 않고 밤을 달린다.기척을 죽이고 접근한다. 상대가 눈치채기 전에 배후에서 살며시 다가가서 괴롭히는 것이다.아름다운 스타일은 전신의 발달한 근육 덕분이다. 소리도 내지 않고 밤을 달린다.기척을 죽이고 접근한다. 상대가 눈치채기 전에 배후에서 살며시 다가가서 괴롭히는 것이다.도감에 없음등장하지 않음아름다운 털과 스타일에 쉽게 매료되지만 변덕스럽고 흉포한 포켓몬이다.폭슬라이와 영역을 두고 다툰다. 소리를 전혀 내지 않고 먹이의 배후에 접근한다.","악","","육상"
"야나프","깊은 숲에서 사는 포켓몬. 머리에 난 잎사귀를 먹으면 피로가 거짓말처럼 사라진다.상태가 안좋은 포켓몬에게 머리의 나뭇잎을 나누어준다. 피곤함을 풀어주는 효과가 있는 것이다.나무열매를 잘 찾아 여기저기에서 나누어 주는 상냥함을 가졌다.기운이 없는 포켓몬에게 머리의 잎사귀를 나눠준다. 피로를 풀어주는 효과가 있다.나무열매를 잘 찾아 여기저기에서 모아 동료에게 나누어 주는 상냥함을 가졌다.자료 없음","풀","","육상"
"야나키","성질이 사납고 가시가 박힌 꼬리를 휘둘러서 싸운다. 머리의 잎사귀는 매우 쓰다.가시가 잔뜩 돋아난 꼬리로 상대에게 공격. 기질이 격렬한 포켓몬.가시가 박힌 꼬리를 휘둘러 힘껏 쳐서 상대를 공격한다. 머리의 잎은 아주 쓰다.가시가 잔뜩 박힌 꼬리를 상대에게 힘껏 쳐서 공격한다. 기질이 격한 포켓몬이다.기질이 격하여 가시가 박힌 꼬리를 휘두르며 싸운다. 머리의 잎사귀는 매우 쓰다.자료 없음","풀","","육상"
"바오프","머리의 털은 화가나면 온도가 올라 300도 이상이 된다. 열매를 머리의 털로 구워서 먹는다.화산의 동굴에서 산다. 머리의 털 안이 타올라서 300도의 고온이 된다.지능이 높고 나무열매는 구운 뒤 먹는 습성이 있다. 사람 도와주기를 좋아한다.화산 동굴에서 산다. 머리의 송아리 속이 불타고 있어 300도나 되는 높은 온도가 된다.자료 없음","불꽃","","육상"
"바오키","단것을 아주 좋아한다. 체내에서 불을 태워 에너지로 쓴다.몸 안의 불꽃을 불태워 머리나 꼬리에서 불똥을 흩뿌려 적을 그을리게 한다.흥분하면 머리나 꼬리에서 불티가 날아올라 뜨거워진다. 왜인지 달콤한 것을 매우 좋아한다.몸속에서 태운 불꽃을 머리나 꼬리로 흩뿌려서 상대를 태운다.흥분하면 머리나 꼬리에서 불티가 날아올라 뜨거워진다. 왜인지 달콤한 것을 매우 좋아한다.자료 없음","불꽃","","육상"
"앗차프","머리카락에 모아둔 물은 영양이 가득. 식물에게 뿌리면 크게 자란다.건조한 환경에 약하다. 머리의 송아리에 모은 물을 꼬리로 뿌려 주위를 적신다.머리 송아리에 모은 물은 영양 듬뿍. 꼬리를 사용해서 그 물을 초목에 뿌린다.머리의 송아리에 모은 물은 영양이 가득하다. 식물에 뿌려주면 크게 자란다.자료 없음","물","","육상"
"앗차키","머리카락에 물을 모은다. 저수량이 줄어들면 꼬리로 물을 빨아올려 보급한다.꼬리에서 고압의 물을 발사하면 콘크리트 벽조차 파괴하는 위력.물이 깨끗한 장소를 좋아한다. 머리에 모아둔 물이 줄어들면 꼬리에서 빨아올려 보급한다.꼬리에서 발사하는 고압의 물은 콘크리트 벽도 파괴할 수 있는 위력을 지녔다.물이 깨끗한 장소를 좋아한다. 머리에 모아둔 물이 줄어들면 꼬리에서 빨아올려 보급한다.자료 없음","물","","육상"
"몽나","몽나에게 꿈을 먹혀버리면 꿈의 내용을 잊어버린다. 보통 공중에 떠 있다.사람이나 포켓몬이 본 꿈을 먹는다. 즐거운 꿈을 먹으면 핑크색의 연기를 내뿜는다.나쁜 꿈에 시달리고 있는 포켓몬이나 사람 앞에 나타나 그 꿈을 먹어버리는 포켓몬.사람이나 포켓몬이 본 꿈을 먹는다. 즐거운 꿈을 먹으면 핑크색의 연기를 내뿜는다.나쁜 꿈에 시달리고 있는 포켓몬이나 사람 앞에 나타나 그 꿈을 먹어버리는 포켓몬.사람이나 포켓몬이 본 꿈을 먹는다. 즐거운 꿈을 먹으면 핑크색의 연기를 내뿜는다.도감에 없음등장하지 않음깊은 밤중 머리맡에 나타난다. 꿈을 먹는 동안 몸에 있는 무늬가 어렴풋이 빛난다.꿈을 먹고 연기를 내뿜는다. 즐거운 꿈이면 핑크색이고 악몽이면 거무스름하다.","에스퍼","","육상"
"몽얌나","이마로부터 나오고 있는 연기 속에는 사람이나 포켓몬이 꾼 꿈이 가득 차있다.먹은 꿈을 실체화시킨다. 이마에서 피어나는 연기가 꿈에서 나왔었던 것으로 모습을 바꾼다.이마에서 나오는 꿈연기는 먹은 꿈의 내용에 따라 여러 가지 색으로 변한다.이마로부터 나오고 있는 연기 속에는 사람이나 포켓몬이 꾼 꿈이 가득 차있다.이마에서 나오는 꿈연기는 먹은 꿈의 내용에 따라 여러 가지 색으로 변한다.이마로부터 나오고 있는 연기 속에는 사람이나 포켓몬이 꾼 꿈이 가득 차있다.이마에서 나오는 꿈연기는 먹은 꿈의 내용에 따라 여러 가지 색으로 변한다.도감에 없음등장하지 않음뿜어내는 연기가 거무스름할 때는 가까이 가지 않는 것이 좋다. 악몽이 현실이 되기 때문이다.언제나 선잠을 자며 꿈을 꾼다. 잠에서 깨면 매우 불쾌해하므로 가만히 내버려 두자.","에스퍼","","육상"
"콩둘기","트레이너의 명령을 잘 듣는 성격이지만 어려운 지시는 이해하지 못하는 경우도 있다.마을 안에 살고 있는 포켓몬. 낯가림이 없기에 공원이나 광장에 많이 모여든다.매우 건망증이 심한 포켓몬으로 트레이너에게 명령을 받았어도 새로운 명령을 기다리고 있다.마을 안에 살고 있는 포켓몬. 낯가림이 없기에 공원이나 광장에 많이 모여든다.매우 건망증이 심한 포켓몬으로 트레이너에게 명령을 받았어도 새로운 명령을 기다리고 있다.마을 안에 살고 있는 포켓몬. 낯가림이 없기에 공원이나 광장에 많이 모여든다.도감에 없음등장하지 않음사람이 사는 곳에 나타난다. 먹이를 뿌려주면 수백 마리가 모여들기 때문에 주의해야 한다.건망증이 심하고 영리하지 않지만 사람을 잘 따르고 착실해서 귀여워하는 트레이너가 많다.","노말","비행","비행"
"유토브","아무리 멀리 떨어져 있어도 트레이너의 곁으로 반드시 돌아올 수 있다.유토브가 사는 숲 안에는 싸움이 없는 평화로운 나라가 있다고 믿어져지고 있다.세계 어디에 있어도 자신의 둥지가 있는 곳을 알 수 있어 트레이너를 잃어버리지 않는다.유토브가 사는 숲 안에는 싸움이 없는 평화로운 나라가 있다고 믿어져지고 있다.세계 어디에 있어도 자신의 둥지가 있는 곳을 알 수 있어 트레이너를 잃어버리지 않는다.유토브가 사는 숲 안에는 싸움이 없는 평화로운 나라가 있다고 믿어져지고 있다.세계 어디에 있어도 자신의 둥지가 있는 곳을 알 수 있어 트레이너를 잃어버리지 않는다.도감에 없음등장하지 않음하늘을 나는 속도는 그저 그렇다. 아무리 멀리 떨어져 있어도 주인과 자신의 둥지를 기억하고 있다.영리하고 기억력이 좋다. 배달원이 파트너로 선택하는 경우가 많다.","노말","비행","비행"
"켄호로우","수컷은 머리의 장식을 흔들어 상대를 위협한다. 암컷의 비행 능력은 수컷을 뛰어 넘는다.수컷은 머리에 장식을 가졌다. 트레이너 이외의 사람에게는 절대로 친하지 않는 성질.머리 장식을 흔들거리며 위협하는 수컷이지만 나는 것은 암컷보다 서툴다.수컷은 머리의 장식을 흔들어 상대를 위협한다. 암컷의 비행 능력은 수컷을 뛰어 넘는다.수컷은 머리에 장식을 가졌다. 트레이너 이외의 사람에게는 절대로 친하지 않는 성질.수컷은 머리의 장식을 흔들어 상대를 위협한다. 암컷의 비행 능력은 수컷을 뛰어 넘는다.수컷은 머리에 장식을 가졌다. 트레이너 이외의 사람에게는 절대로 친하지 않는 성질.도감에 없음등장하지 않음높은 비행 능력을 가졌다. 암컷은 지구력이 뛰어나며 수컷은 비행 속도가 뛰어나다.영리한 만큼 프라이드도 높다. 켄호로우의 트레이너가 되면 모두에게 실력을 인정받는다.","노말","비행","비행"
"줄뮤마","방전하면 갈기가 빛난다. 갈기를 빛내는 방식으로 동료와 커뮤니케이션을 한다.소나기구름으로 하늘이 뒤덮여지면 나타난다. 갈기털로 천둥을 캐치하여 전기를 모은다.방전하면 갈기가 빛난다. 갈기가 빛나는 횟수나 리듬으로 동료와 대화한다.소나기구름으로 하늘이 뒤덮여지면 나타난다. 갈기털로 천둥을 캐치하여 전기를 모은다.방전하면 갈기가 빛난다. 갈기가 빛나는 횟수나 리듬으로 동료와 대화한다.소나기구름으로 하늘이 뒤덮여지면 나타난다. 갈기털로 천둥을 캐치하여 전기를 모은다.방전하면 갈기가 빛난다. 갈기가 빛나는 횟수나 리듬으로 동료와 대화한다.등장하지 않음","전기","","육상"
"제브라이카","번개같은 순발력. 제브라이카가 전속력으로 달리면 천둥 소리가 울려 퍼진다.기질이 격렬하여 화가 나면 갈기털에서 사방팔방으로 전격을 마구 쏘아대므로 위험.격렬한 기질의 소유자. 날뛰면 갈기에서 번개를 사방팔방으로 방전한다.천둥번개 같은 순발력을 가지고 있다. 제브라이카가 전속력으로 달리면 천둥소리가 울려 퍼진다.격렬한 기질의 소유자. 날뛰면 갈기에서 번개를 사방팔방으로 방전한다.천둥번개 같은 순발력을 가지고 있다. 제브라이카가 전속력으로 달리면 천둥소리가 울려 퍼진다.등장하지 않음","전기","","육상"
"단굴","육각형의 귀를 가졌다. 땅 속에서 압축된 몸은 철에 지지않을 정도로 견고하다.100년 전 대지진 때 갈라진 틈에서 발견되었다. 몸 안에 에너지 코어를 가졌다.육각형의 구멍은 귀다. 소리가 나는 쪽으로 걸어가는 습성을 가지고 있다.육각형의 귀를 가지고 있다. 땅속 싶은 곳에서 압축된 몸은 철 못지않게 단단하다.100년 전 대지진 때 갈라진 땅에서 발견되었다. 체내에 에너지 코어를 가지고 있다.육각형 귀를 가지고 있다. 땅속 깊은 곳에서 압축된 몸은 철 못지않게 단단하다.100년 전 대지진 때 갈라진 땅에서 발견되었다. 체내에 에너지 코어를 가지고 있다.땅속 깊은 곳에서 태어났다. 가까운 친구인 꼬마돌이나 멜리시와 딱딱함을 비교한다.육각형의 구멍은 귀다. 소리가 나는 쪽으로 걸어가지만 소리가 그치면 당황해서 넘어진다.육각형의 구멍은 귀다. 귀 안에 에너지 코어가 있어서 손을 넣으면 화를 낸다.땅이 갈라진 곳의 단층에서 발견되었다. 몸을 구성하는 성분은 수백 년도 전의 흙이다.등장하지 않음철과 비슷하게 단단하지만 오랫동안 물에 담가두면 조금 부드러워진다고 한다.소리에 반응해 움직인다. 에너지 코어의 영향으로 만지면 조금 따듯하다.","바위","","광물"
"암트르","파워가 넘쳐 흐르면 오렌지색의 결정이 빛을 낸다. 동굴에서 지하수를 찾는다.몸 안에서 진정되지 않아 새어나온 에너지가 뭉쳐 오렌지색의 결정이 되었다.기운이 넘치면 핵이 튀어나온다. 몸의 방향을 바꾸지 않고 전후좌우로 재빠르게 움직일 수 있다.체내에서 처리되지 못하고 빠져나온 에너지가 덩어리져서 주황색 결정이 되었다.기운이 넘치면 핵이 튀어나온다. 몸의 방향을 바꾸지 않고 전후좌우로 재빠르게 움직일 수 있다.체내에서 처리되지 못하고 빠져나온 에너지가 덩어리져서 주황색 결정이 되었다.기운이 넘치면 핵이 튀어나온다. 몸의 방향을 바꾸지 않고 전후좌우로 재빠르게 움직일 수 있다.오렌지 결정은 에너지의 덩어리다. 한 조각으로 덤프트럭 100대분의 연료가 된다.동굴에서 지하수를 찾는다. 물 자체는 잘 마시지 못해서 홀짝홀짝 천천히 핥는다.몸에서 넘쳐흐르는 에너지가 오렌지색 결정이 되었다. 다이아몬드도 부술 정도로 견고하다.오렌지색 결정은 큰 에너지의 덩어리다. 가치가 있어 노려지는 일도 있다.등장하지 않음오렌지색 결정이 빛나기 시작하면 조심해야 한다. 에너지를 쏘아대기 때문이다.소리로 주위 상황을 살핀다. 화나게 하면 몸의 방향을 바꾸지 않은 채로 쫓아온다.","바위","","광물"
