"name","desc","type1","type2","egg_group"
"조로아","상대의 모습으로 둔갑해보여 놀래킨다. 말수가 적은 어린아이로 둔갑하고 있는 일이 많은 것 같다.사람이나 다른 포켓몬으로 변한다. 자신의 상태를 숨겨 위험으로부터 몸을 지키기 위한 것이다.상대와 똑 닮게 둔갑한 것처럼 보이게 하여 속이거나 놀라게 해서 그 틈에 도망가는 일이 많다.사람이나 다른 포켓몬으로 둔갑한다. 자신의 정체를 감추어 위험으로부터 몸을 지키는 것이다.상대와 똑 닮게 둔갑한 것처럼 보이게 하여 속이거나 놀라게 해서 그 틈에 도망가는 일이 많다.사람이나 다른 포켓몬으로 둔갑한다. 자신의 정체를 감추어 위험으로부터 몸을 지키는 것이다.도감에 없음겁이 많은 포켓몬으로 동료와 있을 때 말고는 거의 다른 누군가로 둔갑하고 있다.평소에 수다스러운 아이가 과묵해졌다면 조로아가 둔갑한 것일지도 모른다.등장하지 않음무언가로 둔갑하는 능력을 익힌 것은 겁이 많은 성질의 영향인 듯하다.먹이를 찾아 사람으로 둔갑하여 마을에 나타나기도 한다. 주로 아이로 둔갑한다.","악","","육상"
"조로아크","상대를 홀리는 것으로 무리의 안전을 지켜온 포켓몬. 동료간의 결속이 단단하다.한번에 많은 사람을 속이는 힘을 가졌다. 환영을 사용해 서식지를 지킨다.조로아크를 잡으려 한 사람을 환영의 경치 속에 가둬서 혼내줬다고 전해진다.한번에 많은 사람을 속이는 힘을 가졌다. 환영을 사용해 서식지를 지킨다.상대를 속여 무리의 안전을 유지해온 포켓몬이다. 동료 간의 결속력이 강하다.한번에 많은 사람을 속이는 힘을 가졌다. 환영을 사용해 서식지를 지킨다.상대를 속여 무리의 안전을 유지해온 포켓몬이다. 동료 간의 결속력이 강하다.도감에 없음둔갑술이 가능할 뿐만 아니라 수백 명의 사람에게 환상을 보여줄 수 있는 힘을 가졌다.인간에게 거처를 들킬 위기에 처하면 환상을 보여줘서 숲을 떠돌게 한다고 전해진다.등장하지 않음동료애가 깊은 포켓몬이다. 무서운 환상을 보게 만들어서 거처나 무리를 지킨다.고독한 트레이너는 조로아크에게 환상을 보여주도록 명령하여 혼자만의 외로움을 달랜다.","악","","육상"
"치라미","꼬리로 서로의 몸을 매만지며 인사한다. 꼬리의 손질을 거르지 않고 언제나 예쁘게 하고 있다.너무 깨끗한 성격의 포켓몬. 꼬리를 빗자루 대신으로 해서 언제나 서식지의 먼지를 쓸어내고 있다.서로의 꼬리로 상대를 철저히 깨끗하게 만드는 것이 치라미끼리의 인사다.깨끗함을 좋아하는 포켓몬이다. 꼬리를 빗자루 대신 써서 항상 거처의 먼지를 쓸어낸다.서로의 꼬리로 상대를 철저히 깨끗하게 만드는 것이 치라미끼리의 인사다.깨끗함을 좋아하는 포켓몬이다. 꼬리를 빗자루 대신 써서 항상 거처의 먼지를 쓸어낸다.도감에 없음결벽증이 있어서 조금의 더러움도 용서하지 않는다. 꼬리를 걸레 삼아 꼼꼼히 더러운 것을 닦아 낸다.자신의 몸이나 보금자리를 청소하느라 더러워진 꼬리는 깨끗한 샘물로 하루에 걸쳐서 씻는다.등장하지 않음꼬리로 더러운 것을 떨어낸다. 청소를 할 때는 도움이 되지만 결벽증이 있어서 힘들기도 하다.꼬리로 쓰다듬으며 서로 인사한다. 꼬리 털이 많은 쪽이 조금 으스댄다.","노말","","육상"
"치라치노","하얀 체모는 특별한 기름으로 코팅되어 있기 때문에 적의 공격을 받아넘긴다.하얀 털은 감촉이 정말 좋다. 먼지나 정전기가 전혀 생기지 않는다.치라치노의 몸은 특별한 기름으로 뒤덮여 있어 펀치 등 상대의 공격을 받아넘긴다.하얀 털은 감촉이 정말 좋다. 먼지나 정전기가 전혀 생기지 않는다.치라치노의 몸은 특별한 기름으로 뒤엎여 있어 펀치 등 상대의 공격을 받아넘긴다.하얀 털은 감촉이 정말 좋다. 먼지나 정전기가 전혀 생기지 않는다.치라치노의 몸은 특별한 기름으로 뒤엎여 있어 펀치 등 상대의 공격을 받아넘긴다.도감에 없음하얀 털은 몸에서 나오는 기름으로 코딩되어 적의 공격도 매끄럽게 피한다.전신에서 배어 나오는 기름은 매우 부드럽다. 거친 피부가 고민인 사람에게도 효과적이다.등장하지 않음먼지 한 톨도 용납하지 않는 결벽증. 몸에서 나오는 기름을 둥지에 발라서 코팅한다.특별한 기름이 스며든 털은 공격을 받아넘긴다. 기름은 높은 가격에 거래되고 있다.","노말","","육상"
"고디탱","리본처럼 생긴 촉각으로 사이코 파워를 증폭시킨다. 무언가를 꼼짝않고 응시하고 있다.포켓몬이나 트레이너를 쭉 관찰한다. 고디탱에게만 보이는 무언가를 지켜보고 있는 듯하다.뭐든지 가만히 바라본다. 관찰에 몰두해 버려서 공격을 눈치채지 못할 때도 있다.리본 모양의 더듬이로 사이코 파워를 증폭시킨다. 무언가를 가만히 바라보고 있다.포켓몬이나 트레이너를 가만히 관찰한다. 고디탱만 볼 수 있는 무언가를 바라보고 있는 것 같다.리본 모양의 더듬이로 사이코 파워를 증폭시킨다. 무언가를 가만히 바라보고 있다.포켓몬이나 트레이너를 가만히 관찰한다. 고디탱만 볼 수 있는 무언가를 바라보고 있는 것 같다.도감에 없음등장하지 않음아직 아기지만 리본을 닮은 더듬이에 모아둔 사이코 파워로 싸울 때도 있다.아무도 없는데 나직이 운다. 고디탱에게만 보이는 뭔가와 이야기하는 듯하다.","에스퍼","","인간형"
"고디보미","최면술로 포켓몬이나 사람을 조종한다.잠든채로 고디보미에게 다른 곳으로 옮겨졌다는 옛날 이야기가 각지에 전해진다.별빛이 파워의 근원. 밤이 되면 사이코파워로 돌을 띄우게 하여 별의 배치를 기록한다.별빛이 빛나는 밤에 잠자는 아이들을 조종해서 논다는 이야기가 많이 남아 있다.별빛이 힘의 원천이다. 밤이 되면 사이코 파워로 돌을 띄워 별의 배치를 표시한다.별빛이 빛나는 밤에 잠자는 아이들을 조종해서 논다는 이야기가 많이 남아 있다.별빛이 힘의 원천이다. 밤이 되면 사이코 파워를 돌을 띄워 별의 배지를 표시한다.별빛이 빛나는 밤에 잠자는 아이들을 조종해서 논다는 이야기가 많이 남아 있다.도감에 없음등장하지 않음별이 빛나는 밤에 잠이 든 아이들을 데려간다고 전해져 심판의 마녀라고도 불린다.별이 빛나는 밤에 가장 사이코 파워가 높아지는 듯하다. 우주와의 관계는 불명확하다.","에스퍼","","인간형"
"고디모아젤","강력한 사이코파워의 영향으로 공간이 뒤틀려 주위에 밤하늘이 보인다.별이 있는 곳이나 움직임으로 미래를 예지한다. 트레이너의 수명도 보인다.별의 움직임에서 미래를 읽는다. 트레이너의 수명을 알게 된 고디모아젤은 부르짖으며 슬퍼한다.강력한 사이코파워의 영향으로 공간이 뒤틀려 주위에 밤하늘이 보인다.별이 있는 곳이나 움직임으로 미래를 예지한다. 트레이너의 수명도 보인다.강력한 사이코파워의 영향으로 공간이 뒤틀려 주위에 밤하늘이 보인다.별이 있는 곳이나 움직임으로 미래를 예지한다. 트레이너의 수명도 보인다.도감에 없음등장하지 않음별의 움직임으로 미래를 본다. 엄청난 사이코 파워를 가졌지만 싸움을 좋아하지 않는 기질을 가졌다.고디모아젤을 통해 자신의 최후를 보게 된 악인은 그날을 마지막으로 종적을 감추었다.","에스퍼","","인간형"
"유니란","사이코 파워를 방출하여 습격해 온 적을 격퇴한다. 텔레파시로 동료와 회화한다.특수한 액체로 몸이 둘러싸여져 있기 때문에 어떠한 환경이라도 살아갈 수 있다.몸이 특수한 액체로 둘러싸여 있어 어떤 곤란한 상황이라도 문제없다.사이코 파워를 방출하여 달려드는 상대를 물리친다. 텔레파시로 동료와 대화한다.몸이 특수한 액체로 둘러싸여 있어 어떤 곤란한 상황이라도 문제없다.사이코 파워를 방출하여 습격해 온 적을 격퇴한다. 텔레파시로 동료와 회화한다.도감에 없음등장하지 않음텔레파시로 의사소통을 한다. 강한 충격을 받으면 몸을 둘러싸고 있는 액체가 흘러나온다.특수한 액체로 몸을 둘러싸고 있어 우주에서도 살 수 있다고 전해진다.","에스퍼","","부정형"
"듀란","2개로 분열한 뇌를 가지고 있기 때문에 갑자기 다른 행동을 하는 경우가 있다.2개로 분열된 뇌가 서로 똑같은 것을 생각할 때 최대 파워가 발휘된다.분열한 2개의 뇌로 같은 생각을 하면 낼 수 있는 사이코 파워는 최고가 된다.2개로 분열한 뇌를 가지고 있기 때문에 갑자기 다른 행동을 하는 경우가 있다.분열한 2개의 뇌로 같은 생각을 하면 낼 수 있는 사이코 파워는 최고가 된다.2개로 분열한 뇌를 가지고 있기 때문에 갑자기 다른 행동을 하는 경우가 있다.분열한 2개의 뇌로 같은 생각을 하면 낼 수 있는 사이코 파워는 최고가 된다.도감에 없음등장하지 않음2개의 뇌가 의견 일치했을 때의 염동력은 주변 1km까지 영향을 미친다고 한다.분열한 2개의 뇌는 생각이 거의 일치하지 않아 전혀 행동을 예측할 수 없다.","에스퍼","","부정형"
"란쿨루스","란쿨루스끼리 서로 악수하면 두뇌가 네트워크로 연결되어 사이코 파워가 증폭된다.바위를 묵사발로 만드는 손 힘을 가진 팔을 조종하여 싸운다. 높은 지능을 지닌 포켓몬이다.발휘한 사이코 파워를 사용해 특수한 액체로 만들어진 팔을 조종해서 바위를 부순다.란쿨루스끼리 서로 악수하면 두뇌가 네트워크로 연결되어 사이코 파워가 증폭된다.발휘한 사이코 파워를 사용해 특수한 액체로 만들어진 팔을 조종해서 바위를 부순다.란쿨루스끼리 서로 악수하면 두뇌가 네트워크로 연결되어 사이코 파워가 증폭된다.도감에 없음등장하지 않음초능력을 사용하는 것보다는 자랑거리인 팔을 휘둘러서 때려눕히는 것을 선호한다.특수한 액체를 마시면 지혜를 얻는다고 전해지지만 란쿨루스 이외에는 맹독이다.","에스퍼","","부정형"
"꼬지보리","잠수가 특기인 새 포켓몬. 좋아하는 음식인 물이끼를 먹기 위해 수중을 헤엄치며 다닌다.적에게 습격받으면 온몸의 깃털에서 물안개를 낸다. 물안개 숨어 도망친다.나는 것보다 헤엄치는 것이 특기로 수중에 잠수해서는 제일 좋아하는 물이끼를 기쁘게 먹는다.상대에게 공격당하면 전신의 깃털에서 물보라를 내뿜는다. 물안개에 숨어들어 도망친다.나는 것보다 헤엄치는 것이 특기로 수중에 잠수해서는 제일 좋아하는 물이끼를 기쁘게 먹는다.자료 없음","물","비행","수중1,비행"
"스완나","새벽녘이 되면 모든 스완나들이 춤추기 시작한다. 한복판에서 춤추는 스완나가 무리의 리더.부리의 공격은 강렬. 긴 목을 휘면서 연속으로 찌르기를 반복한다.우아한 외모와 다르게 날개로 힘차게 날개 치며 수천 Km를 계속 날 수 있다.새벽이 오면 스완나들이 춤추기 시작한다. 한가운데에서 춤추는 스완나가 무리의 우두머리다.자료 없음","물","비행","수중1,비행"
"바닐프티","마이너스 50도의 숨결을 뿜는다. 눈의 결정을 만들어 근처에 눈을 내리게 한다.아침 해의 에너지를 쬔 고드름이 포켓몬이 되었다. 눈에 몸을 묻어 잠든다.아침 햇살을 받은 고드름에서 태어났다고 하는 포켓몬. 마이너스 50도의 숨결을 내뿜는다.마이너스 50도의 숨결을 내뱉는다. 눈 결정을 만들어 주변에 눈이 내리게 한다.아침 해의 에너지를 받은 고드름이 포켓몬이 되었다. 눈에 몸을 묻고 잠든다.마이너스 50도의 숨결을 내뱉는다. 눈 결정을 만들어 주변에 눈이 내리게 한다.아침 해의 에너지를 받은 고드름이 포켓몬이 되었다. 눈에 몸을 묻고 잠든다.고드름에서 태어난 포켓몬이다. 차가운 숨으로 눈 결정을 만들어 눈을 뿌린다.껴안으면 차가워서 기분이 좋다. 더운 지방에서는 한 집에 1마리씩 두고 소중하게 여기는 포켓몬이다.마이너스 50도 냉기를 내뱉는다. 따뜻한 장소에 있으면 조금씩 작아진다.아침 햇살을 받은 고드름이 아직 녹고 싶지 않다고 소원하여 태어났다. 밤에는 눈 속에 들어가 잠든다.등장하지 않음더운 곳에서는 살 수 없다. 냉기를 뿜어 눈을 내리게 한 뒤 쌓인 눈 속에 들어가 잠든다.고드름에서 태어났다고 전해진다. 마이너스 50도의 냉기를 뿜어 주변을 얼려 살기 좋게 만든다.","얼음","","광물"
"바닐리치","설산에서 서식하는 포켓몬. 먼 옛날 빙하기 때 남쪽 토지로 이동해 왔다.작은 얼음의 알맹이를 많이 만들어내서 자신의 몸을 적의 눈에서 숨긴다.주변 공기를 차갑게 해서 얼음 알갱이를 발생시켜서 상대의 몸을 얼려버린다.설산에서 서식하는 포켓몬이다. 먼 옛날 빙하기 때 남쪽 땅으로 이동해 왔다.주변 공기를 차갑게 해서 얼음 알갱이를 발생시켜서 상대의 몸을 얼려버린다.설산에서 서식하는 포켓몬이다. 먼 옛날 빙하기 때 남쪽 땅으로 이동해 왔다.더운 날에는 몸이 녹는다. 얼리면 다시 돌아오지만 몸 형태는 조금 일그러진다.빙하기 때부터 존재해왔다. 얼음 결정을 조종하여 적을 얼린 뒤 박치기로 부순다.얼음 입자를 세게 내뿜어 적의 몸을 얼린다. 알로라의 바닐리치는 전체적으로 몸집이 작다.빙하기에 꿋꿋하게 살아남은 매우 강인한 포켓몬. 특히 더운 지방에서는 뛰어난 인기를 자랑한다.등장하지 않음깨끗한 물을 마셔서 얼음으로 된 몸을 크게 만든다. 날씨가 맑은 날에는 잘 발견되지 않는다.마이너스 100도의 냉기로 적을 얼리지만 목숨은 뺏지 않는 상냥한 기질을 가졌다.","얼음","","광물"
"배바닐라","물을 대량으로 들이마셔 체내에서 눈구름을 만든다. 강한 눈보라로 상대를 괴롭힌다.2개의 머리가 동시에 화내면 뿔에서 눈보라를 내뿜어 주변을 눈으로 뒤덮는다.대량의 물을 들이마셔 몸 안에서 눈구름으로 바꾼다. 화나면 강한 눈보라를 일으킨다.2개의 머리가 동시에 화내면 뿔에서 눈보라를 내뿜어 주변을 눈으로 뒤덮는다.대량의 물을 들이마셔 몸 안에서 눈구름으로 바꾼다. 화나면 강한 눈보라를 일으킨다.2개의 머리가 동시에 화내면 뿔에서 눈보라를 내뿜어 주변을 눈으로 뒤덮는다.대량의 물을 들이마셔 몸 안에서 눈구름으로 바꾼다. 화나면 강한 눈보라를 일으킨다.두 개의 머리 각각에 뇌가 있고 각자의 의견이 일치하면 강한 눈보라를 뿜어 적을 덮친다.한쪽 머리를 잃어도 특별히 문제없이 살 수 있다. 몸속에서 눈구름을 만든다.2개의 입에서 눈보라를 뿜어낸다. 어디에서든 눈을 만들어 내기 때문에 스키어나 스노보더에게 인기다.아침 해에 녹아내리던 2마리의 바닐리치가 붙어서 추운 밤에 다시 얼어붙으면 태어난다.등장하지 않음분노가 정점에 달하면 눈보라를 불게 하여 적도 아군도 꽁꽁 열려버린다.체온은 마이너스 6도 전후이다. 2마리의 바닐리치가 붙어서 태어났다고 한다.","얼음","","광물"
"사철록","체모가 산야의 풀과 똑같은 색과 향기로 변한다. 적의를 느끼면 풀숲에 숨는다.계절이 바뀔 때가 되면 털과 냄새가 변화한다. 계절을 알리는 포켓몬.계절이 바뀌었을 때뿐 아니라 기온이나 습도에 따라서도 몸의 색깔은 조금 변한다.계절이 바뀌는 시기가 되면 털과 냄새가 변화한다. 계절을 알리는 포켓몬이다.계절이 바뀌었을 때뿐 아니라 기온이나 습도에 따라서도 몸의 색깔은 조금 변한다.자료 없음","노말","풀","육상"
"바라철록","계절에 따라 거처를 바꾼다. 사람들은 바라철록의 뿔로 계절의 변화를 느낀다.계절에 따라 뿔에서 자라는 풀과 꽃이 바뀐다. 훌륭한 뿔의 소유자가 무리를 이끌고 있다.계절의 변화와 함께 거처를 바꾸기에 바라철록이 봄을 나른다고 말하는 사람도 있다.계절에 따라 거처를 바꾼다. 사람들은 바라철록의 뿔에서 계절의 변화를 느낀다.계절의 변화와 함께 거처를 바꾸기에 바라철록이 봄을 나른다고 말하는 사람도 있다.자료 없음","노말","풀","육상"
"에몽가","볼의 전기 주머니에서 만든 전기를 막의 안쪽에 모아 두었다가 활공하면서 전기를 방전한다.숲의 나무 위에 산다. 망토 같은 막의 안쪽에서 전기를 내뿜으며 활공한다.막을 펼쳐서 하늘을 날면서 볼의 전기 주머니에 모은 전기로 상대를 감전시킨다.숲의 나무 위에 산다. 망토 같은 막의 안쪽을 방전시키며 활공한다.볼의 전기 주머니에서 만든 전기를 막 안쪽에 모아 활공하며 전기를 발산한다.숲의 나무 위에 산다. 망토 같은 막의 안쪽을 방전시키며 활공한다.볼의 전기 주머니에서 만든 전기를 막 안쪽에 모아 활공하며 전기를 발산한다.망토 같은 막으로 활공한다.전기를 흩뿌려서 적도 자기편도 전부 감전시킨다.전격으로 나무열매나 벌레포켓몬을 알맞게 구워서 먹는다. 콕코구리가 뚫은 나무 구멍이 주된 서식지다.전기를 모아 하늘을 난다. 천둥이 치는 한밤중에는 하늘을 가득 메울 정도로 많다.전기를 흩뿌리면서 날기 때문에 새포켓몬들이 다가오지 않는다. 덕분에 먹이를 독차지할 수 있다.등장하지 않음전기를 내뿜으며 하늘을 춤추듯이 난다. 귀엽지만 성가시다.달콤한 나무열매를 매우 좋아한다. 볼주머니에 먹이를 너무 많이 넣어 잘 날지 못할 때도 있다.","전기","비행","육상"
"딱정곤","쪼마리와 함께 있을 때 기이한 자극을 받으면 진화하는 희한한 포켓몬이다.위험을 느끼면 목에서 산성 액체를 내뿜는다. 쪼마리를 노리는 포켓몬.쪼마리를 덮쳤을 때 전기 에너지를 받으면 왜인지 진화해 버린다.쪼마리와 함께 있을 때 전기적인 자극을 받으면 진화하는 이상한 포켓몬이다.쪼마리를 덮쳤을 때 전기 에너지를 받으면 왜인지 진화해 버린다.쪼마리와 함께 있을 때 기이한 자극을 받으면 진화하는 희한한 포켓몬이다.쪼마리를 덮쳤을 때 전기 에너지를 받으면 왜인지 진화해 버린다.도감에 없음등장하지 않음전기 에너지에 반응하는 이상한 체질을 지녔다. 쪼마리와 함께 있으면 진화한다.입에서 내뿜는 액체로 쪼마리의 껍질을 녹여서 내용물만 먹어 치운다.","벌레","","벌레"
"슈바르고","고속으로 날아올라 날카로운 창으로 상대를 찌른다. 불리한 상대에게도 용감하게 맞서 싸운다.쪼마리의 껍데기를 몸에 지녀 진화하는 포켓몬. 강철의 갑옷이 전신을 가드한다.쪼마리에게 뺏은 껍질로 몸을 에워싸 가드하면서 2개의 창으로 찔러온다.쪼마리의 껍데기를 몸에 지녀 진화하는 포켓몬. 강철의 갑옷이 전신을 가드한다.쪼마리에게 뺏은 껍질로 몸을 에워싸 가드하면서 2개의 창으로 찔러온다.쪼마리의 껍데기를 몸에 지녀 진화하는 포켓몬. 강철의 갑옷이 전신을 가드한다.도감에 없음등장하지 않음쪼마리의 껍질을 빼앗아 완전히 무장했다. 가라르지방에서는 매우 인기가 높다.창을 겨누고 적에게 돌격한다. 창파나이트와의 결투를 그린 그림이 유명하다.","벌레","강철","벌레"
"깜놀버슬","몬스터볼을 닮은 무늬로 유혹하여 독 포자를 내뿜는다. 어째서 닮았는지는 수수께끼이다.어째서인지 몬스터볼과 닮은 포켓몬. 잡으려고 하는 적에게 독포자를 불어대서 격퇴.몬스터볼과 똑 닮은 무늬로 포켓몬을 유인해 독포자를 뿌린다.몬스터볼을 닮은 무늬로 유인한 후 독 포자를 뿌려댄다. 왜 닮았는지는 불가사의다.몬스터볼과 똑 닮은 무늬로 포켓몬을 유인해 독 포자를 뿌린다.몬스터볼을 닮은 무늬로 유인한 후 독 포자를 뿌려댄다. 왜 닮았는지는 불가사의다.몬스터볼과 똑 닮은 무늬로 포켓몬을 유인해 독 포자를 뿌린다.도감에 없음등장하지 않음몬스터볼을 많이 닮았는데 그 의미와 이유는 아직 아무도 모른다.양손에서 내뿜는 포자는 맹독이지만 잘 말리면 복통약이 된다고 한다.","풀","독","식물"
"뽀록나","양 팔의 몬스터 볼을 닮은 갓을 흔들흔들 움직여서 사냥감을 유혹하는 댄스를 춘다.몬스터볼과 닮은 우산으로 먹이를 유인하려고 하지만 속아드는 포켓몬은 많지 않다.양손의 삿갓을 움직여 먹이를 유인하는 댄스를 춘다. 눅눅한 장소를 좋아한다.몬스터볼 무늬의 삿갓을 보여주며 먹이를 유인하려 하지만 속아 넘어가는 포켓몬은 드물다.양팔의 몬스터볼을 닮은 삿갓을 한들한들 흔들어 먹이를 유인하는 춤을 춘다.몬스터볼 무늬의 삿갓을 보여주며 먹이를 유인하려 하지만 속아 넘어가는 포켓몬은 드물다.양팔의 몬스터볼을 닮은 삿갓을 한들한들 흔들어 먹이를 유인하는 춤을 춘다.도감에 없음등장하지 않음독 포자를 내뿜는다. 빨리 씻어내지 않으면 그곳에 버섯이 자라난다.평상시에는 잘 움직이지 않는다. 떨어져 있는 몬스터볼 옆에서 그저 가만히 대기할 뿐이다.","풀","독","식물"
"탱그릴","얇은 베일같은 팔로 상대의 몸을 동여 맨 채로 바다의 밑바닥에 가라앉는다.먹이를 독으로 마비시켜 8000미터 심해에 있다고 하는 서식지에 데리고 간다.베일 같은 손발을 휘감아 마비시켜서 8000m의 심해에 데려가 끝장낸다.먹이를 독으로 마비시켜 8000m 심해에 있다는 거처로 데리고 간다.베일 같은 손발을 휘감아 마비시켜서 8000m의 심해에 데려가 끝장낸다.먹이를 독으로 마비시켜 8000m 심해에 있다는 거처로 데려간다.베일 같은 손발을 휘감아 마비시켜서 8000m의 심해에 데려가 끝장낸다.도감에 없음베일 같은 손발을 휘감아 헤엄치는 먹이를 심해로 끌고 간다.적을 마비시켜서 물에 빠뜨리기 위해 베일 같은 손발에는 눈에 보이지 않는 독침이 잔뜩 있다.등장하지 않음베일과도 같은 손발로 먹이를 끌어안아 8000m 아래의 심해로 끌고 들어간다.해저에 가라앉은 고대 도시의 주민이 포켓몬이 되었다는 전설이 남아 있다.","물","고스트","부정형"
"탱탱겔","탱탱겔이 사는 곳에 흘러들어온 배는 가라앉고 승무원들의 목숨도 빼앗긴다고 전해진다.몸에 빨아들인 바닷물을 기세 좋게 내뿜어서 나아간다. 생명 에너지를 좋아한다.몸 대부분이 해수다. 해저에는 탱탱겔이 가라앉힌 배로 만들어진 성이 있다고 한다.탱탱겔이 사는 곳에 흘러들어온 배는 가라앉고 승무원들의 목숨도 빼앗긴다고 전해진다.몸 대부분이 해수다. 해저에는 탱탱겔이 가라앉힌 배로 만들어진 성이 있다고 한다.탱탱겔이 사는 곳에 흘러들어온 배는 가라앉고 승무원들의 목숨도 빼앗긴다고 전해진다.도감에 없음여객선이나 유조선 주위를 맴돌며 먹이를 끌어들이기 위해 노리고 있다.어부들이 두려워하는 존재다. 바다로 끌고 들어가 목숨을 빼앗아간다는 소문이 있다.등장하지 않음몸의 대부분이 바닷물과 같은 성분으로 이루어져 있다. 침몰선을 거처로 삼는다.보름달이 뜨면 무리를 거느리고 해수면에 모습을 드러낸다. 먹이가 오기를 기다리는 것이다.","물","고스트","부정형"
