"name","desc","type1","type2","egg_group"
"배쓰나이","붉은 배쓰나이와 푸른 배쓰나이는 바로 싸움을 할 만큼 사이가 나쁘다. 매우 난폭한 포켓몬.빨강과 파랑의 배쓰나이는 사이가 나쁘지만 어째서인지 색이 다른 개체가무리에 섞여 들어가있을 때가 있다.아주 난폭하고 항상 빨강과 파랑의 배쓰나이는 다투고 있다. 먹으면 의외로 맛있다고 한다.빨강과 파랑 배쓰나이는 사이가 나쁨에도 불구하고 같은 무리에 다른 색 개체가 섞여 있다.아주 난폭하고 항상 빨강과 파랑의 배쓰나이는 다투고 있다. 먹으면 의외로 맛있다고 한다.빨강과 파랑 배쓰나이는 사이가 나쁨에도 불구하고 같은 무리에 다른 색 개체가 섞여 있다.도감에 없음난폭하고 사나운 포켓몬. 빨강과 파랑의 배쓰나이는 영역을 두고 언제나 싸운다. (적색근의 모습)큰 턱으로 뭐든지 먹어 치우는 배쓰나이조차도 더 강한 생물에게는 먹이에 지나지 않는다. (청색근의 모습)난폭해서 배쓰나이 무리가 나타난 호수에는 가재군이나 가재장군 정도밖에 남지 않게 된다. (적색근의 모습)호수의 불량배라고 부르는 사람도 있다. 색이 다른 의미는 아직 제대로 밝혀지지 않았다. (청색근의 모습)등장하지 않음힘이 세기 때문에 낚시꾼들에게 인기가 많다. 무단으로 연못에 놓아줘서 점점 개체 수가 늘어나고 있다. (적색근의 모습)
과거에는 자주 식재료로 쓰였다. 청색근 배쓰나이의 살코기는 담백하고 먹기 쉽다는 듯 하다. (청색근의 모습)옛날에는 식탁에 올랐다. 적색근 배쓰나이의 살코기는 기름이 많아 젊은 층이 좋아한다. (적색근의 모습)
난폭하기로 유명한 포켓몬이다. 제일 많이 싸우는 상대는 적색근의 배쓰나이 무리다. (청색근의 모습)","물","","수중2"
"깜눈크","사막의 모래안에서 생활. 태양으로 따뜻해져버린 모래가 체온의 저하를 막아준다.모래 안에 파묻고 눈과 코를 내놓으며 이동한다. 검은 막이 눈을 보호한다.체온이 내려가지 않게 사막의 뜨거운 모래에 들어가 숨어 생활하고 있다.모래 속에 파고들어 눈과 코를 밖에 내놓고 이동한다. 검은 막이 눈을 보호한다.사막의 모래 속에서 생활한다. 태양 때문에 따뜻해진 모래가 체온 저하를 막아준다.모래 속에 파고들어 눈과 코를 밖에 내놓고 이동한다. 검은 막이 눈을 보호한다.사막의 모래 속에서 생활한다. 태양 때문에 따듯해진 모래가 체온 저하를 막아준다.모래 속에 숨어서 헤엄치는 것처럼 이동한다. 적에게 들키지 않으면서 체온이 내려가지 않기 위한 지혜다.모래 속에 몸을 숨기고 위를 걸어가는 먹이의 다리를 덥석 문다. 가장 좋아하는 것은 톱치.일 년 내내 따듯한 알로라는 지내기 좋은 환경이다. 사막이 아닌 곳에서도 가끔 볼 수 있다.아직 사냥은 서툴러서 주로 사막에서 객사한 것을 먹는다. 사막의 청소부라 불린다.등장하지 않음사막의 밤은 기온이 낮기 때문에 모래 깊숙이 파고들어 해가 뜰 때까지 잠을 자면서 생활한다.작지만 하체의 힘은 세다. 모래를 헤치며 사막을 헤엄치듯 이동한다.","땅","악","육상"
"악비르","여러마리로 무리를 짓는다. 안구를 커버하는 막이 모래바람으로부터 눈을 지킨다.눈을 감싸는 특수한 막이 물체의 열을 감지하기 때문에 어두운 곳이라도 주변이 보이는 것이다.얇은 막으로 덮여 있는 두 눈은 한밤중이라도 보인다. 몇 마리의 무리로 생활한다.여러 마리가 무리를 짓는다. 안구를 감싼 막이 모래 폭풍으로부터 눈을 지켜준다.눈을 감싼 특수한 막이 물체의 열을 감지해서 어두워도 주변을 볼 수 있다.여러 마리가 무리를 짓는다. 안구를 감싼 막이 모래 폭풍으로부터 눈을 지켜준다.눈을 감싼 특수한 막이 물체의 열을 감지해서 어두워도 주변을 볼 수 있다.몇 마리씩 무리를 지어 행동한다. 무리의 중심은 암컷인 경우가 많고 수컷들이 먹이를 모은다.눈을 감싸는 특수한 막 덕분에 한밤중에도 주변을 똑똑히 볼 수 있다.몸이 차가워지는 것을 매우 싫어한다. 기온이 내려가는 밤에는 사막 모래 속으로 깊숙이 파고든다.먹이의 일부는 모래 속에 묻어서 사냥에 실패했을 때의 비상식량으로 삼는다.등장하지 않음어둠 속에서도 볼 수 있는 특수한 두 눈 덕분에 한밤중에도 거침없이 사냥할 수 있다.어둠 속에서도 볼 수 있는 특수한 눈을 가졌지만 사막의 밤은 춥기 때문에 잘 움직이지 않는다.","땅","악","육상"
"악비아르","눈에 띈 사냥감은 놓치지 않는다. 자동차의 몸체를 물어뜯는 강력한 턱을 가졌다.쌍안경 같이 먼 곳의 물건을 확대해 보는 게 가능한 눈을 가졌다.아주 난폭한 포켓몬. 눈앞에서 움직이는 것은 모두 덮쳐서 깨물어 부수려고 한다.마주친 먹이는 놓치지 않는다. 자동차 몸체를 물어뜯을 만큼 강력한 턱을 가지고 있다.아주 난폭한 포켓몬. 눈앞에서 움직이는 것은 모두 덮쳐서 깨물어 부수려고 한다.마주친 먹이는 놓치지 않는다. 자동차 몸체를 물어뜯을 만큼 강력한 턱을 가지고 있다.모래 폭풍 속에서도 50km 앞에 있는 작은 먹이를 발견하는 특수한 두 눈을 가졌다.강력한 턱으로 물고 그대로 힘껏 몸을 비틀어 먹이를 절단한다.50km 떨어져 있는 먹이를 발견하면 사막을 헤엄치듯이 이동하여 덤벼들어 덥석 문다.플라이곤이 일으키는 모래바람에 몸을 숨기고 먹이가 오는 것을 가만히 기다리고 있다.등장하지 않음모래의 건달이라고도 불린다. 강력한 턱으로 두꺼운 철판도 쉽게 물어뜯는다.난폭하지만 먹이를 잡기 위해 모래 속에서 며칠이든 기다리는 강한 인내력도 갖고 있다.","땅","악","육상"
"달막화","체내에서 불꽃이 타고 있어 가만히 있지 않고 뛰어다닌다. 불꽃이 작아지면 잠을 잔다.달막화의 배설물은 뜨겁기에 옛날 사람은 품에 넣어서 몸을 따뜻하게 했다.잠잘 때는 손발을 움츠리고 체내에 타고 있는 600도의 불꽃도 작아져서 차분해진다.달막화의 배설물은 뜨겁기에 옛날 사람은 품에 넣어서 몸을 따뜻하게 했다.잠잘 때는 손발을 움츠리고 체내에 타고 있는 600도의 불꽃도 작아져서 차분해진다.달막화의 배설물은 뜨겁기에 옛날 사람은 품에 넣어서 몸을 따뜻하게 했다.도감에 없음등장하지 않음몸 안에서 타오르는 불꽃이 힘의 원천이다. 불꽃이 작아지면 금세 잠들어 버린다.자고 있을 때는 밀어도 당겨도 절대 쓰러지지 않는다. 길조의 모티브로 인기가 높다.","불꽃","","육상"
"불비달마","체내에서 1400도의 불꽃을 태우는 것으로 덤프카를 펀치로 파괴할 정도의 파워를 만든다.싸움으로 약해지면 바위처럼 움직이지않게 된다. 마음을 닦아서 정신력으로 싸운다.격렬한 싸움으로 상처입으면 바위처럼 굳어져 묵상하며 마음을 연마한다.체내에서 1400도의 불꽃을 태워서 덤프트럭을 펀치로 파괴할 정도의 파워를 만든다.격렬한 싸움으로 상처 입으면 바위처럼 굳어져 묵상하며 마음을 연마한다.체내에서 1400도의 불꽃을 태워서 덤프트럭을 펀치로 파괴할 정도의 파워를 만든다.도감에 없음등장하지 않음혈기왕성한 포켓몬. 굵직한 팔에서 날리는 펀치는 덤프트럭도 가루로 만들어버린다. (노말모드)
명상을 통해 난폭한 마음을 가라앉히고 사이코 파워를 더욱 갈고닦고 있다. (달마모드)체내의 불꽃이 타오를수록 파워가 올라간다. 그 온도는 1400도를 넘기도 한다. (노말모드)
상처를 입으면 바위처럼 움직이지 않게 된다. 묵상으로 정신을 수양하고 있는 것이다. (달마모드)","불꽃","","육상"
"마라카치","업템포의 춤과 소리로 꽃의 씨앗을 쏘아 천적인 새포켓몬을 쫓아 버린다.건조한 토지에 산다. 몸을 리드미컬하게 움직이면 마라카스 같은 소리를 낸다.리드미컬하게 몸을 흔들면 마라카스와 비슷한 소리가 울려 퍼져 놀란 포켓몬은 도망을 간다.업템포의 춤과 소리로 꽃의 씨앗을 쏘아 천적인 새포켓몬을 쫓아 버린다.건조한 땅에서 산다. 몸을 리드미컬하게 움직이면 마라카스 같은 소리를 낸다.업템포의 춤과 소리로 꽃의 씨앗을 쏘아 천적인 새포켓몬을 쫓아 버린다.건조한 땅에서 산다. 몸을 리드미컬하게 움직이면 마라카스 같은 소리를 낸다.도감에 없음등장하지 않음마라카스 같은 소리를 낸다. 리듬이 경쾌해서 새포켓몬은 깜짝 놀라 허둥지둥 날아가버린다.일 년에 한 번 씨를 뿌린다. 꽃의 씨는 영양이 매우 풍부해 사막의 귀중한 식량이다.","풀","","식물"
"돌살이","돌을 녹이는 액체를 입에서 분비하는 것으로 견고한 돌이라도 간단하게 구멍을 뚫을 수 있다.큰 돌에 구멍을 내서 둥지를 만든다. 부서지면 대신할 돌을 발견할 때까지 진정하지 못한다.적당한 사이즈의 돌이 있으면 입에서 액체를 분비해서 안에 들어가기 위한 구멍을 판다.큰 돌에 구멍을 내서 둥지를 만든다. 부서지면 대신할 돌을 발견할 때까지 진정하지 못한다.적당한 사이즈의 돌이 있으면 입에서 액체를 분비해서 안에 들어가기 위한 구멍을 판다.큰 돌에 구멍을 내서 둥지를 만든다. 부서지면 대신할 돌을 발견할 때까지 진정하지 못한다.적당한 사이즈의 돌이 있으면 입에서 액체를 분비해서 안에 들어가기 위한 구멍을 판다.도감에 없음등장하지 않음마음에 드는 돌멩이에 구멍을 파서 보금자리로 삼는다. 단굴이나 탄동에게는 천적이다.집으로 삼기 딱 좋은 돌멩이를 발견하지 못하면 하마돈의 구멍에 살기도 한다.","벌레","바위","벌레,광물"
"암팰리스","영역을 차지하기 위해 암팰리스끼리 서로 격렬하게 싸운다. 바위가 부수어진 쪽이 패배.무거운 바위를 등에 지고 건조한 토지를 며칠이라도 이동할 수 있는 각력을 가졌다.영역 다툼을 할 때 짊어진 바위가 부서지면 불안을 느껴 약해진다.무거운 바위를 등에 지고 건조한 토지를 며칠이라도 이동할 수 있는 각력을 가졌다.영역을 차지하기 위해 암팰리스끼리 서로 격렬하게 싸운다. 바위가 부수어진 쪽이 패배.무거운 바위를 등에 지고 건조한 토지를 며칠이라도 이동할 수 있는 각력을 가졌다.영역을 차지하기 위해 암팰리스끼리 서로 격렬하게 싸운다. 바위가 부수어진 쪽이 패배.도감에 없음등장하지 않음건조한 곳을 좋아하며 비가 내리는 날에는 바위에서 나오지 않는다. 자기 영역에 대한 의식이 강하다.두꺼운 발톱이 최고의 무기다. 거대코뿌리의 프로텍터조차 금이 갈 정도로 딱딱하다.","벌레","바위","벌레,광물"
"곤율랭","가죽을 목까지 끌어올려 방어의 자세를 취한다. 고무같은 탄력으로 대미지를 줄인다.시선에 있는 상대에게 갑자기 부딪혀 공격을 취한다. 매우 단단한 두개골을 가졌다.튼튼한 두개골이 자랑이다. 느닷없이 박치기를 하려고 하지만 무게로 자신도 휘청거린다.가죽을 목까지 늘려서 방어 자세를 취한다. 고무 같은 탄력을 이용해 데미지를 줄인다.튼튼한 두개골이 자랑이다. 느닷없이 박치기를 하려고 하지만 무게로 자신도 휘청거린다.가죽을 목까지 늘려서 방어 자세를 취한다. 고무 같은 탄력을 이용해 데미지를 줄인다.튼튼한 두개골이 자랑이다. 느닷없이 박치기를 하려고 하지만 무게로 자신도 휘청거린다.도감에 없음여러 마리 그룹으로 행동한다. 굼뜨게 다니다 눈이 마주친 상대에게 느닷없이 박치기를 한다.축 늘어난 가죽을 목까지 끌어올려서 가드한다. 가죽이 늘어난 개체일수록 대단하다고 한다.등장하지 않음눈이 마주치면 위험하다! 상대를 가리지 않고 박치기로 공격해오는 성가신 포켓몬이다.튼튼한 가죽으로 몸을 지킨다. 가죽이 다 늘어나면 진화할 때가 되었다고 한다.","악","격투","육상,드래곤"
"곤율거니","영역에 들어온 상대를 집단으로 때려눕힌다. 입에서 산성의 체액을 날린다.머리 장식의 크기로 그룹의 리더를 정한다. 킥 공격으로 콘크리트 블록을 파괴한다.탈피한 가죽을 끌어 올려 데미지를 줄이면서 킥! 볏이 클수록 거만하다.볏의 크기로 그룹의 리더를 정한다. 발차기로 콘크리트 블록을 파괴한다.탈피한 가죽을 끌어 올려 데미지를 줄이면서 킥! 볏이 클수록 거만하다.볏의 크기로 그룹의 리더를 정한다. 발차기로 콘크리트 블록을 파괴한다.도감에 없음거칠고 난폭하지만, 자신의 가족과 무리 동료의 영역을 매우 소중히 여기는 포켓몬이다.침을 뱉어서 상대를 도발한다. 정해진 영역을 가지고 있으며 평생 그곳을 벗어나지 않고 산다.등장하지 않음의욕이 없어 보이는 킥은 노보청이 들고 있는 콘크리트도 부술 정도의 파괴력을 지녔다.매우 거친 성격이지만 가족과 동료와 영역은 소중히 여긴다.","악","격투","육상,드래곤"
"심보러","고대도시를 지키고 있던 기억을 후세에 전하기 위해 언제나 같은 루트를 날고 있는것 같다.고대도시의 수호신 이었다. 구역에 침범한 적을 사이코파워로 공격한다.고대 도시의 수호신. 항상 같은 루트를 순회하며 침입자를 감시하고 있었다.고대 도시의 수호신이었다. 자기 영역을 침범한 상대를 사이코 파워로 공격한다.고대 도시의 수호신. 항상 같은 루트를 순회하며 침입자를 감시하고 있었다.고대 도시의 수호신이었다. 자기 영역을 침범한 상대를 사이코 파워로 공격한다.고대 도시의 수호신. 항상 같은 루트를 순회하며 침입자를 감시하고 있었다.도감에 없음등장하지 않음사이코 파워로 하늘을 난다. 고대 도시의 수호신 또는 수호신의 사자로 일컬어진다.심보러가 나는 사막 아래를 조사해 보니 고대 도시로 여겨지는 자취가 발견되었다.","에스퍼","비행","비행"
"데스마스","가지고 있는 마스크는 데스마스가 인간이었을 때의 얼굴. 가끔 마스크를 보며 운다.고대 묘에 매장되어진 사람의 영혼에서 태어났다. 옛날 기억이 남겨져 있다.무덤에 매장된 사람의 영혼이 포켓몬으로 변했다. 죽기 전 기억이 남아 있다.가지고 있는 마스크는 데스마스가 사람이었을 때의 얼굴이다. 가끔 마스크를 쳐다보며 운다.무덤에 매장된 사람의 영혼이 포켓몬으로 변했다. 죽기 전 기억이 남아 있다.가지고 있는 마스크는 데스마스가 인간이었을 때의 얼굴. 가끔 마스크를 보며 운다.도감에 없음등장하지 않음밤마다 유적을 떠돈다. 가지고 있는 마스크는 자신이 인간이던 시절의 얼굴이라 한다.고대인의 영혼이 포켓몬이 되어 태어났다. 자신의 얼굴을 아는 사람을 찾아 유적을 떠돈다.","고스트","","광물,부정형"
"데스니칸","다가간 사람을 집어삼켜 미라로 만든다는 소문이 있다. 금괴를 즐겨 먹는다.멋진 관으로 위장해서 도굴꾼을 혼내준다. 몸은 순금으로 덮여 있다.진짜 관과 착각해서 다가온 도굴꾼을 몸속에 가둬버린다.다가간 사람을 집어삼켜 미라로 만든다는 소문이 있다. 금괴를 즐겨 먹는다.진짜 관과 착각해서 다가온 도굴꾼을 몸속에 가둬버린다.다가간 사람을 집어삼켜 미라로 만든다는 소문이 있다. 금괴를 즐겨 먹는다.진짜 관과 착각해서 다가온 도굴꾼을 몸속에 가둬버린다.도감에 없음등장하지 않음황금으로 된 반짝거리는 몸. 자신이 인간이었다는 사실을 이제는 기억하지 못할 것이다.오래된 묘지의 벽을 보면 왕의 부를 드러내고자 그려져 있는 경우가 많다.","고스트","","광물,부정형"
"프로토가","고대의 화석에서 부활했다. 깊이 1000미터까지 잠수할 수 있다.약 1억년 전의 바다를 헤엄치고 다녔다. 육지에 올라와서 먹이에게 덮치는 일도 있다.화석에서 부활한 포켓몬. 능숙하게 헤엄쳐 깊이 1000m까지 잠수했었다.약 1억년 전 바다를 헤엄쳐 다녔다. 육지에 올라 먹이를 덮치는 일도 있다.고대 화석에서 부활했다, 1000m 깊이까지 잠수할 수 있다.약 1억년 전 바다를 헤엄쳐 다녔다. 육지에 올라 먹이를 덮치는 일도 있다.고대 화석에서 부활했다, 1000m 깊이까지 잠수할 수 있다.골격을 조사해보니 약 1000m의 심해까지 잠수할 수 있었던 것 같다.많은 거북포켓몬의 조상이라 전해진다. 약 1억 년 전의 따뜻한 바다에서 살았다.고대 화석에서 부활했다. 바다에 살고 있었지만, 먹이를 찾아 지상으로 올라왔다.수심 1000m의 심해에서 육지에 이르기까지 넓은 범위를 사냥터로 삼았다.등장하지 않음많은 거북포켓몬의 선조로 여겨지고 있는 포켓몬이다. 화석에서 복원되었다.","물","바위","수중1,수중3"
"늑골라","바다와 육지에서 생활한다. 손바닥 치기로 유조선의 바닥에 구멍을 뚫는 파워의 소유자.턱의 힘이 무척 강하다. 먹이와 함께 철골이나 바위도 잘게 씹어먹어 버린다.발달한 앞다리로 상대를 세게 쳐서 기절시켜 껍데기나 뼈까지 통째로 깨물어 부쉈다.바다와 육지에서 생활한다. 손바닥으로 쳐서 배 밑바닥에 구멍을 내는 파워의 소유자다.발달한 앞다리로 상대를 세게 쳐서 기절시켜 껍데기나 뼈까지 통째로 깨물어 부쉈다.바다와 육지에서 생활한다. 손바닥으로 쳐서 배 밑바닥에 구멍을 내는 파워의 소유자다.발달한 앞다리로 상대를 세게 쳐서 기절시켜 껍데기나 뼈까지 통째로 깨물어 부쉈다.단단한 등껍질을 만들기 위해 먹이의 딱딱한 껍데기나 뼈도 통째로 깨물어 먹었다.바다와 육지 양쪽에서 활동한다. 육지의 먹이는 바다로 끌고 들어가 처리한다.턱의 힘이 무시무시하다. 암스타나 암나이트의 껍질도 아무렇지 않게 통째로 먹었다.단단한 등껍질을 더욱 튼튼하게 만들기 위해 잡은 먹이는 껍질이나 뼈까지 남기지 않고 먹는다.등장하지 않음물속과 비교하면 움직임이 둔하지만 먹이를 찾아 육지에서도 활동한다.","물","바위","수중1,수중3"
"아켄","새 포켓몬의 조상이라고 불린다.날 수는 없고 가지에서 가지로 뛰어 이동하며 생활하고 있었던 듯하다.화석에서 부활한 포켓몬. 모든 새 포켓몬의 조상이라고 생각되어지고 있다.고대 화석에서 부활했다.나무 위에서 살고 있으나 날지 못해 가지에서 가지 사이를 뛰어 옮겨 다닌다.화석에서 부활한 포켓몬이다. 모든 새포켓몬의 조상이라 여겨지고 있다.새포켓몬의 조상이라고 전해진다. 날 수 없어서 가지에서 가지로 뛰어다니며 생활했다고 한다.화석에서 부활한 포켓몬이다. 모든 새포켓몬의 조상이라 여겨지고 있다.새포켓몬의 조상이라고 전해진다. 날 수 없어서 가지에서 가지로 뛰어다니며 생활했다고 한다.모든 새포켓몬의 조상이다. 아켄 자체는 아직 날지 못해 나무 위를 점프해서 이동했다.날 수는 없었던 것 같으나 나무 위에서부터 활공하여 먹이를 잡았다고 한다.모든 새포켓몬의 선조라고 여겨져 왔지만 최근 연구에서는 아니라는 설도 대두되었다.화석에서 복원되었다. 날개는 있지만 아직 나는 것은 불가능한 고대의 새포켓몬.등장하지 않음새포켓몬의 선조로 불린다. 나무 위에서 살며 나무열매나 벌레포켓몬을 먹는다.","바위","비행","비행,수중3"
"아케오스","지상에서 도움닫기를 하여 날아오른다. 동료와 협력하여 사냥감을 잡는 지능을 가졌다.나는 것보다 달리는 쪽이 특기.자동차에게도 지지 않는 스피드로 뛰어돌아다니며 먹이를 잡아낸다.나는 것보다 달리는 것이 특기로 시속 40km로 달리던 기세로 넓은 하늘로 날아 오른다.지상에서 도움닫기를 하여 날아오른다. 동료와 협력하여 사냥감을 잡는 지능을 가졌다.나는 것보다 달리는 것이 특기로 시속 40km로 달리던 기세로 넓은 하늘로 날아 오른다.지상에서 도움닫기를 하여 날아오른다. 동료와 협력하여 사냥감을 잡는 지능을 가졌다.나는 것보다 달리는 것이 특기로 시속 40km로 달리던 기세로 넓은 하늘로 날아 오른다.날 수도 있었지만 대부분 지상을 뛰어다녔다. 그 시속은 평균 40km이다.무리 지어 사냥을 했다. 먹이를 몰아넣으면 다른 동료가 하늘에서 급습한다.깃털이 매우 가늘어 숙련된 장인이 아니면 복원에 실패한다고 전해지는 고대의 포켓몬.새포켓몬의 조상이라 불린다. 날갯짓하는 근육은 아직 약해서 도움닫기를 하지 않으면 날 수 없다.등장하지 않음비행도 가능하지만 지상에서 먹이를 사냥하는 일을 훨씬 더 잘하는 듯하다.","바위","비행","비행,수중3"
"깨봉이","비위생적인 장소를 좋아한다. 트림하는 것처럼 내뱉는 가스를 흡입하면 1주일간 앓아눕게 된다.쓰레기봉투가 산업폐기물과 화학변화를 일으키는 물질로 포켓몬이 되어 다시 태어났다.더 많은 쓰레기를 찾아 무단 투기하는 사람을 쫓아다닌다. 항상 독가스를 토해내고 있다.쓰레기 봉지가 산업 폐기물과 화학적 변화를 일으켜서 포켓몬으로 다시 태어났다.비위생적인 장소를 좋아한다. 트림하듯이 토해내는 가스를 들이마시면 1주일 동안 잠에 빠진다.쓰레기 봉지가 산업 폐기물과 화학적 변화를 일으켜서 포켓몬으로 다시 태어났다.비위생적인 장소를 좋아한다. 트림하듯이 토해내는 가스를 들이마시면 1주일 동안 잠에 빠진다.비위생적인 곳을 좋아한다. 알로라에서는 자주 질퍽이에게 쫓겨 다니는 모습을 볼 수 있다.배가 부를 때까지 쓰레기를 먹은 후 입에서 독가스를 토해낸다. 실수로 맡으면 즉시 입원해야 한다.숨을 쉬면 독가스가 새어 나온다. 냄새를 맡고 질뻐기가 침을 흘리며 찾아온다.트림처럼 내뱉는 가스는 어린아이가 들이마시면 치명적일 정도로 위험하다.등장하지 않음비위생적인 장소를 좋아한다. 쓰레기를 어질러놓은 채 내버려두면 방에 나타나 그대로 눌러앉는다.쓰레기가 가득 담긴 쓰레기봉투에서 태어났다. 내뿜는 독가스는 가라르의 또도가스가 매우 좋아한다.","독","","광물"
"더스트나","왼팔로 상대를 단단히 잡고 입에서 내뱉는 악취의 독가스로 숨통을 끊는다.쓰레기를 빨아들여 몸의 일부로 만든다. 오른쪽 팔의 손 끝에서 독액을 분사.쓰레기를 흡수해서 체내에서 새로운 종류의 독가스나 독의 액체를 만들어낸다.왼팔로 상대를 꼭 붙들고 입에서 악취가 나는 독가스를 토해내서 마무리한다.쓰레기를 흡수해서 체내에서 새로운 종류의 독가스나 독의 액체를 만들어낸다.왼팔로 상대를 꼭 붙들고 입에서 악취가 나는 독가스를 토해내서 마무리한다.쓰레기를 흡수해서 체내에서 새로운 종류의 독가스나 독의 액체를 만들어낸다.오른쪽 팔에서 날리는 독액에 주의. 살짝 닿기만 해도 미지의 독소가 침범한다.한때 알로라에서 폭발적으로 늘었지만 질퍽이가 오고 난 뒤로 개체 수가 크게 줄었다.왼쪽 팔로 적을 꼭 붙들고 독액을 온몸에 퍼부어 움직임을 막는다.알로라의 더스트나가 좀 더 강인한 것은 질뻐기라는 천적이 있기 때문이라고 전해진다.등장하지 않음먹은 쓰레기가 체내에서 독으로 변화한다. 먹은 쓰레기에 따라 독의 주성분도 바뀐다.오른팔에서 내보내는 독액은 약한 생물이 맞으면 즉사할 정도로 위험하다.","독","","광물"
