"name","desc","type1","type2","egg_group"
"펌킨인","초승달이 뜬 밤에 기분 나쁜 목소리로 노래를 부르며 마을 안을 헤맨다. 그 노래를 들으면 저주를 받는다.머리카락 같은 팔로 사냥감을 조른다. 괴로워하는 모습을 지켜보며 즐거운 듯 노래한다.초승달이 뜬 밤에 기분 나쁜 목소리로 노래를 부르며 마을 안을 헤맨다. 그 노래를 들으면 저주를 받는다.머리카락 같은 팔로 사냥감을 조른다. 괴로워하는 모습을 지켜보며 즐거운 듯 노래한다.도감에 없음등장하지 않음작은 펌킨인은 아이를 흉내 내어 어른을 방심하게 만든 뒤 저세상으로 데려가버린다. (작은 사이즈)한밤중에 몸속에서 들리는 기분 나쁜 울음소리는 저세상에서 고통받는 죽은 자의 울음소리라는 듯하다. (보통 사이즈)작은 몸의 호바귀가 진화한 모습이다. 몸 크기는 유전된다. (작은 사이즈)초승달이 뜨는 밤이 되면 펌킨인이 현관문을 노크한다. 그리고 열어준 사람을 저세상으로 데리고 간다. (보통 사이즈)특별히 큰 몸의 호바귀가 진화한 모습이다. 몸 크기는 유전된다. (특대 사이즈)","고스트","풀","부정형"
"꽁어름","몸을 둘러싼 얼음이 적의 공격을 막는다. 깨져도 냉기로 재빨리 얼음을 얼린다.마이너스 100도의 냉기로 적을 얼려버린다. 만년설로 덮인 산에서 무리를 짓는다.몸을 둘러싼 얼음이 적의 공격을 막는다. 깨져도 냉기로 재빨리 얼음을 얼린다.마이너스 100도의 냉기로 적을 얼려버린다. 만년설로 덮인 산에서 무리를 짓는다.도감에 없음등장하지 않음영하 100도의 냉기로 공기 중의 수분을 얼려서 얼음 갑옷으로 몸을 지킨다.혹한의 지역에 서식한다. 크레베이스의 등에 자신의 발을 얼어붙게 해 고정한다.","얼음","","괴수"
"크레베이스","얼어붙은 몸은 강철처럼 단단하다. 앞을 가로막는 것을 커다란 몸으로 파괴하며 이동한다.등에 수 마리의 꽁어름을 태우고 지내는 모습은 마치 얼음으로 된 항공모함 같다.얼어붙은 몸은 강철처럼 단단하다. 앞을 가로막는 것을 커다란 몸으로 파괴하며 이동한다.등에 수 마리의 꽁어름을 태우고 지내는 모습은 마치 얼음으로 된 항공모함 같다.도감에 없음등장하지 않음여러 마리의 꽁어름을 등에 태우고 고위도의 차가운 바다를 빙산 속에 섞여 헤엄친다.낮 동안의 활동으로 몸의 균열이 깊어지지만 하룻밤 사이에 균열이 없는 몸으로 돌아간다.","얼음","","괴수"
"음뱃","캄캄한 동굴에서 산다. 20만Hz의 초음파를 커다란 귀에서 발사한다.20만Hz의 초음파를 받으면 막강한 레슬러도 현기증이 나 서 있을 수 없다.캄캄한 동굴에서 산다. 20만Hz의 초음파를 커다란 귀에서 발사한다.20만Hz의 초음파를 받으면 막강한 레슬러도 현기증이 나 서 있을 수 없다.도감에 없음과일을 좋아한다. 초음파를 이용해서 잘 익은 것만 골라내 먹는 미식가다.먹이인 과일을 찾아 날아다닌다. 익은 정도를 초음파로 판별할 수 있다.등장하지 않음해가 지면 둥지인 동굴을 나와 날아다니며 잘 익은 과일을 초음파로 찾는다.온갖 주파수의 음파를 조종한다. 초음파를 맞으면 거대한 몸집의 포켓몬도 견디지 못한다.","비행","드래곤","비행"
"음번","달빛조차 없는 어둠 속을 날며 방심하고 있는 사냥감을 덮친다. 어둠 속의 싸움에서는 무적이다.귀에서 발생하는 초음파로 거대한 바위도 분쇄한다. 어둠을 틈타 공격한다.달빛조차 없는 어둠 속을 날며 방심하고 있는 사냥감을 덮친다. 어둠 속의 싸움에서는 무적이다.귀에서 발생하는 초음파로 거대한 바위도 분쇄한다. 어둠을 틈타 공격한다.도감에 없음성질은 난폭하지만 좋아하는 잘 익은 과일을 주면 언제 그랬냐는 듯이 잘 따른다.바위도 부수는 초음파로 눈에 들어오는 모든 것에 공격을 가하는 혈기가 왕성한 포켓몬.등장하지 않음어두워서 아무것도 할 수 없는 상대를 무자비하게 공격한다. 혈기왕성하고 잔인한 성질을 가졌다.어둠 속을 날아다니며 바위도 부수는 초음파로 타격을 입힌 뒤 예리한 이빨로 숨통을 끊는다.","비행","드래곤","비행"
"제르네아스","영원한 생명을 나누어 준다고 한다. 수목의 모습으로 1000년 동안 잠들고 부활한다.머리의 뿔이 일곱 빛깔로 빛날 때 영원한 생명을 나눠준다고 전해진다.영원한 생명을 나누어 준다고 한다. 수목의 모습으로 1000년 동안 잠들고 부활한다.머리의 뿔이 일곱 빛깔로 빛날 때 영원한 생명을 나눠준다고 전해진다.도감에 없음등장하지 않음도감에 없음","페어리","","알미발견"
"이벨타르","날개와 꼬리를 펼치고 빨갛게 빛날 때 살아 있는 생명을 빨아들이는 전설의 포켓몬.수명이 다할 때 모든 생명의 목숨을 빨아들이고 고치의 모습으로 돌아간다고 한다.날개와 꼬리를 펼치고 빨갛게 빛날 때 살아 있는 생명을 빨아들이는 전설의 포켓몬.수명이 다할 때 모든 생명의 목숨을 빨아들이고 고치의 모습으로 돌아간다고 한다.도감에 없음등장하지 않음도감에 없음","악","비행","알미발견"
"지가르데","날카로운 이빨로 상대를 처리한다. 계속 이 몸을 유지할 수 없어서 일정 시간이 지나면 흩어져버린다.셀이라고 불리는 지가르데의 일부가 10%정도 모인 모습. 시속 100km로 대지를 달린다.지가르데의 일부가 1할 정도 모였다. 상대의 품으로 뛰어들어 날카로운 이빨로 물어 버린다.각지의 지가르데 셀이 10% 모였을 때 태어난다. 접근전이 특기다.등장하지 않음도감에 없음","드래곤","땅","알미발견"
"디안시","멜리시의 돌연변이다. 분홍빛으로 빛나는 몸은 세계에서 가장 아름답다고 일컬어진다.양손의 틈으로 공기 중의 탄소를 압축하여 많은 다이아를 한순간에 만들어 낸다.멜리시의 돌연변이다. 분홍빛으로 빛나는 몸은 세계에서 가장 아름답다고 일컬어진다.양손의 틈으로 공기 중의 탄소를 압축하여 많은 다이아를 한순간에 만들어 낸다.도감에 없음등장하지 않음도감에 없음","바위","페어리","알미발견"
"후파","공간을 뒤트는 링으로 모든 것을 멀리 떨어진 곳으로 날려버리고 마는 트러블메이커다.마음에 드는 물건을 링을 사용해 비밀의 거처에 모으고 있다. 링을 통해 순간이동한다.진정한 모습일 때는 거대한 힘을 가지고 있다. 원하는 재물을 손에 넣기 위해 그것이 숨겨진 성을 통째로 빼돌려 사라졌다는 전설이 있다.6개의 링과 6개의 거대한 팔로 수많은 것들을 빼앗는다고 전해진다. 힘이 봉인되어 작은 모습으로 변했다.자료 없음","에스퍼","고스트","알미발견"
"볼케니온","수증기를 뿜어내어 자신의 모습을 짙은 안개 속에 숨긴다. 사람이 오지 않는 산에 산다고 한다.등에 있는 팔로 체내의 수증기를 분사한다. 산 하나를 날려버릴 정도의 위력이다.수증기를 뿜어내어 자신의 모습을 짙은 안개 속에 숨긴다. 사람이 오지 않는 산에 산다고 한다.등에 있는 팔로 체내의 수증기를 분사한다. 산 하나를 날려버릴 정도의 위력이다.도감에 없음등장하지 않음도감에 없음","불꽃","물","알미발견"
