"name","desc","type1","type2","egg_group"
"딜리버드","온종일 먹이를 운반한다. 조난당한 사람이 딜리버드의 먹이로 살아났다는 이야기도 있다.깎아 세운 듯한 절벽 끝에 있는 둥지에서 기다리는 새끼들을 위해 온종일 먹이를 운반하고 있다.언제나 먹이를 운반한다. 위협 당하면 몸을 지키기 위해 가지고 있는 먹이를 던진다.꼬리로 먹이를 감싸 운반하는 포켓몬. 딜리버드에게 먹이를 나누어 받은 덕에 세계의 높은 산을 오른 모험가가 있다.깎아 세운 듯한 절벽 끝에 있는 둥지에서 기다리는 새끼들을 위해 온종일 먹이를 운반하고 있다.온종일 먹이를 운반한다. 조난당한 사람이 딜리버드의 먹이로 살아났다는 이야기도 있다.꼬리로 먹이를 싸서 운반한다. 산에서 조난당한 사람에게 먹이를 나눠주는 습성이 있다.온종일 먹이를 운반한다. 조난당한 사람이 딜리버드의 먹이로 살아났다는 이야기도 있다.깎아 세운 듯한 절벽 끝에 있는 둥지에서 기다리는 새끼들을 위해 온종일 먹이를 운반하고 있다.꼬리로 먹이를 싸서 운반한다. 산에서 조난당한 사람에게 먹이를 나눠주는 습성이 있다.온종일 먹이를 나른다. 산에서 조난당한 사람이 있으면 먹이를 나눠 도와주고 있다.꼬리로 먹이를 싸서 운반한다. 산에서 조난당한 사람에게 먹이를 나눠주는 습성이 있다.온종일 먹이를 나른다. 산에서 조난당한 사람이 있으면 먹이를 나눠 도와주고 있다.꼬리로 먹이를 감싸 운반하는 포켓몬. 딜리버드에게 먹이를 나누어 받은 덕에 세계의 높은 산을 오른 모험가가 있다.원래 추운 토지를 좋아하지만 알로라의 딜리버드는 어느 정도의 더위도 견딜 수 있는 것 같다.자신의 먹이를 사람이나 포켓몬에게 나눠주는 습성이 있어 언제나 먹이를 찾아다니고 있다.조난 당한 사람에게 자신의 먹이를 나눠준다. 잡식이어서 벌레포켓몬을 건네주기도 한다.꼬리로 먹이를 둘러싸서 운반한다. 가장 큰 꼬리를 가진 딜리버드가 무리의 보스다.등장하지 않음온종일 먹이를 운반한다. 조난당한 사람이 딜리버드의 먹이로 살아났다는 이야기도 있다.자신의 먹이를 사람이나 포켓몬에게 나눠주는 습성이 있어 언제나 먹이를 찾아다닌다.","얼음","비행","수중1,육상"
"만타인","유연하게 바다를 헤엄친다. 먹다 남은 음식을 노린 총어가 달라붙어 있어도 신경쓰지 않는다.넓은 바다를 자유롭게 헤엄친다. 스피드가 올라가면 그대로 파도 위를 날아올라 버린다.자유롭게 헤엄치며 입에 들어온 먹이를 먹는다. 온 몸이 까슬까슬하다.맑은 날에는 바다 위를 우아하게 뛰어오르는 만타인 무리를 볼 수 있다. 총어가 들러붙어 있어도 신경 쓰지 않는다.넓은 바다를 자유롭게 헤엄친다. 스피드가 올라가면 그대로 파도 위를 날아올라 버린다.유연하게 바다를 헤엄친다. 먹다 남은 음식을 노린 총어가 달라붙어 있어도 신경쓰지 않는다.파도가 조용할 때는 드넒은 창해를 나는 듯이 헤엄치는 만타인의 무리와 조우한다.유연하게 바다를 헤엄칠 때 먹다 남은 음식을 노린 총어가 지느러미에 달라붙지만 신경 안 쓴다.유연하게 바다를 헤엄친다. 먹다 남은 음식을 노린 총어가 달라붙어 있어도 신경쓰지 않는다.넓은 바다를 자유롭게 헤엄친다. 스피드가 올라가면 그대로 파도 위를 날아올라 버린다.유연하게 바다를 헤엄칠 때 먹다 남은 음식을 노린 총어가 지느러미에 달라붙지만 신경 안 쓴다.헤엄쳐서 스피드가 빨라지면 파도 위에 뛰어올라 그대로 100m나 활공한다.헤엄으로 스피드가 나기 시작하면 파도 위로 튀어오르고 그대로 100미터나 활공한다.헤엄쳐서 스피드가 빨라지면 파도 위에 뛰어올라 그대로 100m나 활공한다.유연하게 바다를 헤엄칠 때 먹다 남은 음식을 노린 총어가 지느러미에 달라붙지만 신경 안 쓴다.맑은 날에는 바다 위를 우아하게 뛰어오르는 만타인 무리를 볼 수 있다. 총어가 들러붙어 있어도 신경 쓰지 않는다.자료 없음우아하게 파도 위를 튀어 오르는 만타인을 그린 그림엽서나 포스터는 인기 있는 알로라 특산품이다.화려하게 헤엄치는 만타인을 동경하여 서핑을 시작했다는 사람도 많이 있다.자료 없음헤엄쳐서 스피드가 빨라지면 파도 위로 뛰어올라 그대로 100m나 활공한다.여유롭게 바다를 헤엄친다. 먹다 남은 음식을 노린 총어가 달라붙어 있어도 신경 쓰지 않는다.","물","비행","수중1"
"무장조","튼튼한 날개가 무거워 보이지만 뼛속은 비어 있어서 가벼우므로 자유롭게 파란 하늘을 날아다닌다.가시나무 안에 둥지를 만든다. 가시에 상처를 입어가며 자란 새끼들의 날개를 단단해진다.빠져나간 날개는 얇고 날카로워 검으로도 사용하기도 했었던 것 같다.전신이 단단한 갑옷으로 둘러싸여 있다. 시속 300km의 스피드로 하늘을 날아 칼날 같은 날카로운 날개로 베어낸다.싸움을 반복하여 너덜너덜해진 강철의 날개는 1년에 1회 다시 돋아나 원래의 날카로움을 되찾는다.강철의 몸과 날개를 지닌 포켓몬. 옛날 사람들은 빠져나간 날개를 사용해 검이나 식칼로 만들었다.가시나무 안에 둥지를 만든다. 가시에 상처를 입어가며 자란 새끼들의 날개를 단단해진다.튼튼한 날개가 무거워 보이지만 뼛속은 비어 있어서 가벼우므로 자유롭게 파란 하늘을 날아다닌다.철 같은 단단한 갑옷으로 덮여 있다. 시속 300km의 스피드로 넓은 하늘을 날아다닌다.튼튼한 날개가 무거워 보이지만 뼛속은 비어 있어서 가벼우므로 자유롭게 파란 하늘을 날아다닌다.가시나무 안에 둥지를 만든다. 가시에 상처를 입어가며 자란 새끼들의 날개를 단단해진다.철 같은 단단한 갑옷으로 덮여 있다. 시속 300km의 스피드로 넓은 하늘을 날아다닌다.튼튼하고 무거워 보이는 철의 몸이지만 얇고 가벼워 시속 300km로 날 수 있다.가시나무 안에 둥지를 만든다. 가시에 상처를 입어가며 자란 새끼들의 날개를 단단해진다.철 같은 단단한 갑옷으로 덮여 있다. 시속 300km의 스피드로 넓은 하늘을 날아다닌다.전신이 단단한 갑옷으로 둘러싸여 있다. 시속 300km의 스피드로 하늘을 날아 칼날 같은 날카로운 날개로 베어낸다.싸움을 반복하여 너덜너덜해진 강철의 날개는 1년에 1회 다시 돋아나 원래의 날카로움을 되찾는다.성장할 때마다 빠지는 날개는 얇고 날카롭다. 옛 전사들은 칼로 이용했다.철로 된 몸은 튼튼하지만 녹슬기 쉬워서 비가 내리는 날엔 둥지에서 가만히 있다.빠진 날개를 가공해서 만드는 식칼은 일류 요리사도 인정할 정도로 날카롭다.강철의 갑옷을 몸에 걸친다. 무거워 보이지만 최고 300km의 속도로 날 수 있다.등장하지 않음날카로운 날개는 검보다 예리하다. 영역을 두고 아머까오와 격렬하게 싸운다.빠진 깃털로 검을 만들 수 있어서 문장 도안으로 인기가 많다.","강철","비행","비행"
"델빌","동료에게 연락을 할 때랑 먹이를 쫓을 때에는 울음소리의 종류가 다르다.동료끼리만 서로 알 수 있는 울음소리로 서로의 위치를 확인해가며 먹이를 몰아붙인다.새벽녘에 주변 일대에 울려 퍼지는 기분 나쁜 울음소리로 자신들의 영역을 어필한다.여러 가지 울음소리를 사용하여 동료와 연락을 주고받아 먹이를 몰아간다. 팀워크는 포켓몬 중 제일이다.동료끼리만 서로 알 수 있는 울음소리로 서로의 위치를 확인해가며 먹이를 몰아붙인다.동료에게 연락을 할 때랑 먹이를 쫓을 때에는 울음소리의 종류가 다르다.각각 다른 울음소리를 사용해서 기분을 알린다. 멋진 연계 플레이로 먹이를 몰아붙여 잡는다.수많은 울음소리를 가려 써서 동료들과 의사소통을 하며 사냥을 하는 지능을 가지고 있다.동료에게 연락을 할 때랑 먹이를 쫓을 때에는 울음소리의 종류가 다르다.동료끼리만 서로 알 수 있는 울음소리로 서로의 위치를 확인해가며 먹이를 몰아붙인다.수많은 울음소리를 가려 써서 동료들과 의사소통을 하며 사냥을 하는 지능을 가지고 있다.새벽녘에 주변 일대에 울려 퍼지는 기분 나쁜 울음소리로 자신들의 영역을 어필한다.동료끼리만 서로 알 수 있는 울음소리로 서로의 위치를 확인해가며 먹이를 몰아붙인다.여러 가지 울음소리를 사용하여 동료와 연락을 주고받아 먹이를 몰아간다. 팀워크는 포켓몬 중 제일이다.자료 없음동료와의 연계가 특기다. 파트너가 되면 트레이너의 명령에 매우 충실하다.동이 트기 전에 기분 나쁜 울음을 반복하여 자신들 무리의 존재를 어필한다.자료 없음","악","불꽃","육상"
"헬가","입에서 뿜어내는 화염에 화상을 입으면 시간이 흘러도 상처난 자리가 쑤시고 지끈거린다.기분 나쁜 울음소리를 들은 포켓몬은 겁을 내서 그대로 곧장 자신의 둥지로 되돌아온다.입에서 내뿜는 불꽃은 체내의 독소를 불태운 것. 코를 찌르는 듯한 냄새가 난다.머리의 뿔이 크게 뒤로 꺾여 있는 헬가가 그룹의 리더 격인 존재다. 동료 간에 경쟁하여 리더가 결정된다.기분 나쁜 울음소리를 들은 포켓몬은 겁을 내서 그대로 곧장 자신의 둥지로 되돌아온다.입에서 뿜어내는 화염에 화상을 입으면 시간이 흘러도 상처난 자리가 쑤시고 지끈거린다.옛날 사람들은 헬가가 으스스하게 멀리서 짖는 소리를 지옥에서 사신이 부르는 소리라고 상상하고 있었다.화가 났을 때 입에서 뿜어내는 불꽃에는 독소도 섞여 있기에 화상을 입으면 계속 욱신거린다.입에서 뿜어내는 화염에 화상을 입으면 시간이 흘러도 상처난 자리가 쑤시고 지끈거린다.기분 나쁜 울음소리를 들은 포켓몬은 겁을 내서 그대로 곧장 자신의 둥지로 되돌아온다.화가 났을 때 입에서 뿜어내는 불꽃에는 독소도 섞여 있기에 화상을 입으면 계속 욱신거린다.헬가가 으스스하게 멀리서 짖으면 지옥에서 사신이 부르는 소리라고 옛날 사람들은 상상하고 있었다.화가 났을 때 입에서 뿜어내는 불꽃에는 독소도 섞여 있기에 화상을 입으면 계속 욱신거린다.머리의 뿔이 크게 뒤로 꺾여 있는 헬가가 그룹의 리더 격인 존재다. 동료 간에 경쟁하여 리더가 결정된다.자료 없음독소가 섞인 불꽃을 불어 상대를 처리한다. 먹이는 무리가 공평하게 나눈다.기분 나쁜 울음소리가 특징이다. 옛날 사람들은 지옥에서 온 사자라고 여겨 두려워했다.자료 없음","악","불꽃","육상"
"킹드라","평소에는 해저동굴에 몸을 숨기고 있는 것 같다. 하품으로 소용돌이를 발생시킨다.힘을 비축하기 위해 깊은 해저에서 잠들어 있는 듯하다. 눈을 뜨면 회오리를 일으킨다고 전해진다.어떤 생물도 접근할 수 없는 깊은 해저에서 자면서 힘을 비축하고 있다고 한다.생물이 살 수 없는 심해에 서식한다. 킹드라의 하품이 소용돌이치는 해류를 만든다고 오랜 세월동안 믿어져왔다.생물이 살지 않는 해저에서 자고 있다. 태풍이 오면 눈을 뜨고 먹이를 찾으러 돌아다닌다고 전해진다.깊은 해저에서 조용히 잔다. 수면으로 올라오면 배를 집어삼킬 정도로 큰 소용돌이가 발생한다.힘을 비축하기 위해 깊은 해저에서 잠들어 있는 듯하다. 눈을 뜨면 회오리를 일으킨다고 전해진다.평소에는 해저동굴에 몸을 숨기고 있는 것 같다. 하품으로 소용돌이를 발생시킨다.해저동굴에 살고 있다. 킹드라가 움직이면 거대한 소용돌이가 생겨난다.평소에는 해저동굴에 몸을 숨기고 있는 것 같다. 하품으로 소용돌이를 발생시킨다.힘을 비축하기 위해 깊은 해저에서 잠들어 있는 듯하다. 눈을 뜨면 회오리를 일으킨다고 전해진다.해저동굴에 살고 있다. 킹드라가 움직이면 거대한 소용돌이가 생겨난다.평소에는 해저동굴에 몸을 숨기고 있는 것 같다. 하품으로 소용돌이를 발생시킨다.어떤 생물도 접근할 수 없는 깊은 해저에서 자면서 힘을 비축하고 있다고 한다.생물이 살 수 없는 심해에 서식한다. 킹드라의 하품이 소용돌이치는 해류를 만든다고 오랜 세월동안 믿어져왔다.생물이 살지 않는 해저에서 자고 있다. 태풍이 오면 눈을 뜨고 먹이를 찾으러 돌아다닌다고 전해진다.도감에 없음등장하지 않음폭풍우가 휘몰아치면 해수면에 모습을 드러낸다. 망나뇽과 맞닥뜨리면 격렬한 싸움이 시작된다.떨어진 비늘은 왕족에게 헌상될 정도의 최상품으로 심오한 빛을 띤다.","물","드래곤","수중1,드래곤"
"코코리","재롱을 부릴 생각으로 코를 휘두르며 오지만 굉장한 힘이 실려있어서 위험하다.애정 표현으로 코를 부딪쳐 오지만 힘이 있기 때문에 조심하지 않으면 날아가 버린다.아침 일찍 인기척이 없는 물가에 찾아와 긴 코를 능숙하게 써서 몸에 물을 끼얹는다.강 근처에서 굴을 파고 산다. 보금자리 근처에 코로 표시를 해놔서 자신의 구역이라고 동료에게 알려준다.긴 코를 써서 물을 끼얹는다. 동료가 모여들면 서로 물을 끼얹는다. 흠벅 젖은 몸을 물가에서 말린다.코코리의 커다란 귀는 부채 역할. 더워지면 파닥파닥 부채질 해서 몸을 식힌다. 새끼라도 힘은 매우 세다.애정 표현으로 코를 부딪쳐 오지만 힘이 있기 때문에 조심하지 않으면 날아가 버린다.재롱을 부릴 생각으로 코를 휘두르며 오지만 굉장한 힘이 실려있어서 위험하다.몸은 작지만 힘이 장사다. 어른인 사람을 가볍게 등에 태우고 걸어다닌다.재롱을 부릴 생각으로 코를 휘두르며 오지만 굉장한 힘이 실려있어서 위험하다.애정 표현으로 코를 부딪쳐 오지만 힘이 있기 때문에 조심하지 않으면 날아가 버린다.몸은 작지만 힘이 장사다. 어른인 사람을 가볍게 등에 태우고 걸어다닌다.애정 표현으로 코를 부딪쳐 오지만 힘이 있기 때문에 조심하지 않으면 날아가 버린다.몸은 작지만 힘이 장사다. 어른인 사람을 가볍게 등에 태우고 걸어 다닌다.강 근처에서 굴을 파고 산다. 보금자리 근처에 코로 표시를 해놔서 자신의 구역이라고 동료에게 알려준다.긴 코를 써서 물을 끼얹는다. 동료가 모여들면 서로 물을 끼얹는다. 흠벅 젖은 몸을 물가에서 말린다.자료 없음","땅","","육상"
"코리갑","잘 드는 단단한 송곳니랑 더욱이 견고한 피부로 몸통박치기는 집을 무너뜨릴 정도다.송곳니가 길고 클수록 무리 중에서 서열이 높다. 송곳니가 자라는 데는 시간이 걸린다.자그만 공격으로는 흠집 하나 안 날 만큼 단단한 피부로 덮였다.몸을 둥글게 말아 고속회전으로 상대에게 돌진하는 공격이 주특기. 한번 구르기 시작하면 좀처럼 멈추지 않는다.단단한 몸으로 부딪치면 집도 부서진다. 그 힘을 이용해 산길을 막고있는 토사를 치우는 일을 돕는다.덤프트럭도 쉽게 잡아끄는 장사꾼. 바위처럼 단단해진 피부는 웬만한 공격으로는 흠집도 나지 않는다.송곳니가 길고 클수록 무리 중에서 서열이 높다. 송곳니가 자라는 데는 시간이 걸린다.잘 드는 단단한 송곳니랑 더욱이 견고한 피부로 몸통박치기는 집을 무너뜨릴 정도다몸을 웅크려 회전하면서 돌진하며 공격한다. 민가를 일격에 조각조각 날려버린다.잘 드는 단단한 송곳니랑 더욱이 견고한 피부로 몸통박치기는 집을 무너뜨릴 정도다.송곳니가 길고 클수록 무리 중에서 서열이 높다. 송곳니가 자라는 데는 시간이 걸린다.몸을 웅크려 회전하면서 돌진하며 공격한다. 민가를 일격에 조각조각 날려버린다.잘 드는 단단한 송곳니랑 더욱이 견고한 피부로 몸통박치기는 집을 무너뜨릴 정도다.송곳니가 길고 클수록 무리 중에서 서열이 높다. 송곳니가 자라는 데는 시간이 걸린다.몸을 둥글게 말아 고속회전으로 상대에게 돌진하는 공격이 주특기. 한번 구르기 시작하면 좀처럼 멈추지 않는다.단단한 몸으로 부딪치면 집도 부서진다. 그 힘을 이용해 산길을 막고있는 토사를 치우는 일을 돕는다.자료 없음","땅","","육상"
"폴리곤2","혹성 개발을 할 수 있도록 폴리곤을 버전업 했지만 아직 하늘도 날지 못한다.더욱 연구가 진행되어 능력이 올라갔다. 가끔 프로그램에 없는 행동을 보인다.최신 과학으로 진화한 인공 포켓몬. 가끔 프로그램에 없는 반응을 보인다.인간이 과학의 힘으로 만들어냈다. 인공 지능을 지니고 있어서 새로운 동작이나 감정을 혼자서 익혀간다.더욱 연구가 진행되어 능력이 올라갔다. 가끔 프로그램에 없는 행동을 보인다.혹성 개발을 할 수 있도록 폴리곤을 버전업 했지만 아직 하늘도 날지 못한다.행성개발용 프로그램이 인스톨되어 있다. 우주와 같은 진공 공간에서도 활동할 수 있다.혹성 개발을 할 수 있도록 버전업 됐으나 아직도 힘든 듯하다.혹성 개발을 할 수 있도록 폴리곤을 버전업 했지만 아직 하늘도 날지 못한다.더욱 연구가 진행되어 능력이 올라갔다. 가끔 프로그램에 없는 행동을 보인다.행성개발을 할 수 있도록 버전업 되었지만 아직은 힘든 듯하다.더욱 연구가 진행되어 능력이 올라갔다. 가끔 프로그램에 없는 행동을 보인다.행성 개발용 프로그램이 인스톨되어 있다. 우주와 같은 진공 공간에서도 활동할 수 있다.인간이 과학의 힘으로 만들어냈다. 인공 지능을 지니고 있어서 새로운 동작이나 감정을 혼자서 익혀간다.행성 개발을 시야에 넣어 당시의 최신 기술로 폴리곤을 업데이트했다.행성 개발을 목표로 폴리곤을 버전 업 했지만 아직 꿈에 도달하지 못했다.AI를 탑재했다. 자력으로 다양한 것을 습득하지만 필요 없는 것까지 배운다.우주 공간에서도 죽지 않지만 무중력 상태에서는 제대로 몸을 가누지 못한다.등장하지 않음폴리곤을 특별한 데이터로 업데이트했다. 다양한 것을 스스로 배우고 성장한다.AI 기능을 탑재한 결과 폴리곤2끼리만 통하는 수수께끼의 언어로 말하기 시작했다.","노말","","광물"
"노라키","뿔의 휘어진 상태가 주변 공기의 흐름을 미묘하게 바꿔서 이상한 공간을 만들어낸다.뿔의 모양을 보고 있으면 감각이 점점 이상해져서 자신의 힘으로 서 있을 수 없게 된다.떨어진 뿔의 둥근 구슬을 갈아 마시면 푹 잘 수 있다고 한다.멋지게 생긴 뿔은 미술품으로 비싸게 팔리기 때문에 멸종 직전까지 남획됐었던 포켓몬이다.뿔의 모양을 보고 있으면 감각이 점점 이상해져서 자신의 힘으로 서 있을 수 없게 된다.뿔의 휘어진 상태가 주변 공기의 흐름을 미묘하게 바꿔서 이상한 공간을 만들어낸다.뿔을 응시하고 있으면 원의 중심에 빨려 들어가는 것 같은 이상한 기분이 든다.뿔의 휘어진 상태가 주변 공기의 흐름을 미묘하게 바꿔서 이상한 공간을 만들어낸다.뿔의 모양을 보고 있으면 감각이 점점 이상해져서 자신의 힘으로 서 있을 수 없게 된다.뿔을 응시하고 있으면 원의 중심에 빨려 들어가는 것 같은 이상한 기분이 든다.뿔의 휘어진 상태가 주변의 공기흐름을 미묘하게 바꿔서 이상한 공간을 만들어낸다.멋지게 생긴 뿔은 미술품으로 비싸게 팔리기 때문에 멸종 직전까지 남획됐었던 포켓몬이다.등장하지 않음","노말","","육상"
"루브도","꼬리 끝에서 분비되는 액체를 여기저기에 칠해 자신의 영역을 어필한다.어른이 되면 동료로부터 등에 발자국 마크를 받는 습성을 가진다.꼬리 끝에서 분비되는 수수께끼의 액체의 색깔은 루브도라 확정 짓는다.꼬리 끝에서 배어 나오는 체액으로 영역 주변에 자신의 마크를 그린다. 5000종의 마크가 발견됐다.어른이 되면 동료로부터 등에 발자국 마크를 받는 습성을 가진다.꼬리 끝에서 분비되는 액체를 여기저기에 칠해 자신의 영역을 어필한다.꼬리를 붓처럼 써서 영역에 마크를 그린다. 그 종류는 5000개 이상이다.꼬리 끝에서 분비되는 액체를 여기저기에 칠해 자신의 영역을 어필한다.어른이 되면 동료로부터 등에 발자국 마크를 받는 습성을 가진다.꼬리를 붓처럼 써서 영역에 마크를 그린다. 그 종류는 5000개 이상이다.어른이 되면 동료로부터 등에 발자국 마크를 받는 습성을 가진다.꼬리 끝에서 배어 나오는 체액으로 영역 주변에 자신의 마크를 그린다. 5000종의 마크가 발견됐다.꼬리의 끝에서 배어 나오는 체액으로 독자적인 마크를 그려 영역을 어필한다.자신의 영역을 나타내는 마크를 여기저기 그리기 때문에 루브도가 많은 동네의 벽은 낙서투성이다.꼬리 끝에서 나오는 체액은 루브도의 감정에 따라 색조가 변화한다.꼬리 끝에서 나오는 체액으로 마크를 그린다. 마크에 따라서는 마니아에게 비싼 값에 거래된다.등장하지 않음","노말","","육상"
"배루키","항상 기운이 넘친다. 강해지기 위해 계속 져도 상대에게 맞선다.만만한 상대를 발견하면 바로 공격해오기 때문에 몸집이 작아도 방심은 할 수 없다.격투 감각을 닦기 위해 모든 상대에게 맞선다. 오기가 굉장히 세다.매일 트레이닝하지 않으면 스트레스가 쌓이기 때문에 트레이너는 키울 때 스케줄 관리에 여러모로 고민해야 한다.만만한 상대를 발견하면 바로 공격해오기 때문에 몸집이 작아도 방심은 할 수 없다.항상 기운이 넘친다. 강해지기 위해 계속 져도 상대에게 맞선다.툭하면 싸우려 드는 것으로 유명하다. 자신보다 큰 상대에게 도전하므로 상처가 끊이지 않는다.항상 기운이 넘친다. 강해지기 위해 계속 져도 상대에게 맞선다.만만한 상대를 발견하면 바로 공격해오기 때문에 몸집이 작아도 방심은 할 수 없다.툭하면 싸우려 드는 것으로 유명하다. 자신보다 큰 상대에게 도전하므로 상처가 끊이지 않는다.항상 기운이 넘친다. 강해지기 위해 계속 져도 상대에게 맞선다.격투 감각을 닦기 위해 모든 상대에게 맞선다. 오기가 굉장히 세다.매일 트레이닝하지 않으면 스트레스가 쌓이기 때문에 트레이너는 키울 때 스케줄 관리에 여러모로 고민해야 한다.자료 없음항상 기운이 넘친다. 강해지기 위해 지고 또 져도 계속 상대에게 맞선다.만만한 상대를 발견하면 바로 공격해오기 때문에 몸집이 작아도 방심은 할 수 없다.","격투","","알미발견"
